Figure ID,Figure Path,Figure Label,Figure Caption
fig1,articles_all/10.1016.j.intermet.2011.10.010/figures/gr1.jpg,Fig. 1,"XRD patterns and SEM images of: (a) and (b) as-cast Al0alloy, (c) and (d) as-annealed Al0alloy."
fig2,articles_all/10.1016.j.intermet.2011.10.010/figures/gr2.jpg,Fig. 2,"XRD spectrums of as-cast CoCrFeNiTiAlxalloys: (a) Al0.5, (b) Al1.0, (c) Al1.5, (d) Al2.0and (e) enlarged peaks around 43.5°."
fig3,articles_all/10.1016.j.intermet.2011.10.010/figures/gr3.jpg,Fig. 3,"SEM images of as-cast CoCrFeNiTiAlxalloys after etched by aqua regia: (a) Al0.5, (b) Al1.0, (c) Al1.5and (d) Al2.0."
fig4,articles_all/10.1016.j.intermet.2011.10.010/figures/gr4.jpg,Fig. 4,"TEM images and corresponding SAED pattern of as-cast Al1.0alloy: (a), (b) and (c) Dendrite region; (d) Interdendrite region."
fig5,articles_all/10.1016.j.intermet.2011.10.010/figures/gr5.jpg,Fig. 5,"XRD spectrums of as-annealed CoCrFeNiTiAlxalloys: (a) Al0.5, (b) Al1.0, (c) Al1.5and (d) Al2.0."
fig6,articles_all/10.1016.j.intermet.2011.10.010/figures/gr6.jpg,Fig. 6,"SEM images of as-annealed CoCrFeNiTiAlxalloys without etching : (a) Al0.5, (b) Al1.0, (c) Al1.5and (d) Al2.0."
fig7,articles_all/10.1016.j.intermet.2011.10.010/figures/gr7.jpg,Fig. 7,TEM images and corresponding SAED pattern of as-annealed Al1.0alloy.
fig8,articles_all/10.1016.j.intermet.2011.10.010/figures/gr8.jpg,Fig. 8,Relationship between ∆Smixandδvalues of some high-entropy alloy systems.
