Section Heading,Section Title,Paragraph,Figures,Tables
0,Abstract,"The maximization of the mixing entropy with the optimal range of enthalpy in high-entropy alloys (HEAs) can promote the formation of a stable single solid-solution phase with the absence of competing intermetallic compounds. The resultant effects, such as lattice distortion, can contribute to excellent mechanical properties, which has motivated numerous efforts to develop and design single-phase HEAs. However, challenges still remain, particularly on quantifying the lattice distortion and relating it to materials properties. In this study, we have developed a NbTaTiV refractory HEA with a single body-centered-cubic (BCC) structure using an integrated experimental and theoretical approach. The theoretical efforts include thermodynamic modeling, i.e., CALculation of PHAse Diagram (CALPHAD). The microstructural evolutions have been investigated by systematic heat-treatment processes. The typical dendrite microstructure was observed, which is caused by the elemental segregation during the solidification in the as-cast condition. The structural inhomogeneity and chemical segregation were completely eliminated by the proper homogenization treatment at 1200 °C for 3 days. The homogeneous elemental distribution was quantitatively verified by the Atom Probe Tomography (APT) technique. Importantly, results indicate that this HEA exhibits the high yield strength and ductility at both room and high temperatures (up to 900 °C). Furthermore, the effects of the high mixing entropy on the mechanical properties are discussed and quantified in terms of lattice distortions and interatomic interactions of the NbTaTiV HEA via first-principles calculations. It is found that the local severe lattice distortions are induced, due to the atomic interactions and atomic-size mismatch in the homogenization-treated NbTaTiV refractory HEA.",[],[]
1,Introduction,"Novel metallic alloys beyond Ni-based superalloys with high strengths, thermal stabilities, and desirable ductility at high temperatures are highly desirable in the aviation and aerospace industries. To meet the increasing demand of elevated-temperature alloys, exotic multi-principal-element metallic alloy systems, also referred to as high-entropy alloys (HEAs), have been proposed and studied due to their simple microstructures and promising properties. The ideal HEA-design strategy is to form a single solid-solution phase, considering the configurational entropy (>1.5R, whereRis the ideal gas constant), and the enthalpy of formation(ΔHf)with the combinations of alloy components [1–8]_ENREF_1. The reduction of the Gibbs free energy by the high configurational entropy leads to the formation of the simple solid-solution phase, such as face-centered-cubic (FCC) [9], body-centered-cubic (BCC) [10–13], and hexagonal-close-packed (HCP) [14,15] structures. These features, in turn, contribute to attractive materials properties, especially, high hardness/strengths, and excellent softening resistance at elevated and cryogenic temperatures [3–5]. These properties of the near-equimolar HEAs are known to be associated with the locally-strained atomic structures (lattice distortion) in the simple-single solid-solution phase. Moreover, the recently-developed twinning or transformation-induced plasticity (TWIP or TRIP) HEAs, whose compositions are greatly deviated from the near-equimolar ratios, have also attracted the increasing attention due to their excellent mechanical properties [1,5,16–25].",[],[]
1,Introduction,"There have been extensive efforts to develop single-phase refractory HEAs for high-temperature applications above 1100 °C [10–13,26–28] and to comprehend the underlying relationship between their unique microstructure and mechanical performance. However, limited studies have investigated the lattice distortions in HEAs, using x-ray or neutron diffraction [29–31]. Furthermore, the quantitative evaluation of the lattice distortion, through statistical calculations with experimental observations, is still not fully developed. Moreover, only a small number of alloy systems have been verified as single BCC solid-solution phases from experiments [32,33]. For instance, many HEAs exhibit not only elemental segregations in the as-cast condition, but also the formation of small amounts of ordered phases after the heat treatment [27,34–36]. The chemical inhomogeneity and second-phase formation could hinder the fundamental and in-depth understanding of the main strengthening effect of HEAs. Therefore, the development of single solid-solution phase HEAs with homogeneous elemental distributions is vital to elucidate how lattice distortions affect mechanical properties. In the present study, we have designed a NbTaTiV refractory HEA, which contains a single BCC solid-solution phase, via the CALculation of PHAse Diagram (CALPHAD) approach [37–39]. The structure of the NbTaTiV alloy was investigated, using the integrated experimental and theoretical approach. The systematical heat treatments were conducted to develop the single-phase solid-solution microstructure with the fully-homogenous elemental distribution.",[],[]
1,Introduction,"Furthermore, we investigated the lattice distortion and the local atomic environment of the BCC NbTaTiV alloy system through theab initiomethod, based on Special Quasirandom Structures (SQS) [40] that approximate random distributions of atomic species in a medium-sized supercell. The fully-homogeneous single-phase NbTaTiV refractory HEA shows excellent yield strengths at room and high temperatures (up to 900 °C), which are mostly induced by the lattice distortion. The in-depth understanding of the lattice-distortion effect on mechanical properties gained through this investigation is expected to provide the alloy-design strategy for a significant step forward in obtaining the in-depth understanding of the refractory HEAs' microstructures and properties for high-temperature applications.",[],[]
2.1,Experimental methods.Materials,"The alloys were prepared from Nb, Ta, Ti, and V elements of 99.99 wt percent (wt.%) purity by vacuum arc-melting. Prior to each alloying, the chamber was evacuated to 10−5torr. After the chamber pressure reached the desired value, the ultra-high purity argon gas was supplied to produce an arc beam. A Ti getter was used to consume traces of oxygen and hydrogen for all melting steps. To achieve a fully-homogeneous distribution of elements, the ingot was melted more than 10 times, by flipping them over between each step. From the master alloys, rods with a 4-mm diameter and 50-mm length were solidified in a Cu mold under the Ar atmosphere, followed by direct casting into cylindrical rods, using a drop-casting technique. These fabricated alloys were sealed in the vacuumed (10−2torr) quartz tube with the triple-pumped argon and experienced the heat treatments at 1000 °C for 1 day, 1200 °C for 1 day, and 1200 °C for 3 days. After that, the samples were water quenched.",[],[]
2.2,Experimental methods.Computational methodologies,"The CALPHAD calculations were carried out, using the TCNI8 thermodynamic database supplied by ThermoCalc™ [41]. This database covers the entire composition ranges of all six constituent binaries of the NbTaTiV system. However, it is anticipated that the inclusion of thermodynamic descriptions for all ternaries will enhance the reliability of the database especially in applications for HEAs. Recent publications [37,38,42] detail the database developments and applications of the CALPHAD modeling for HEAs.",[],[]
2.3,Experimental methods.Microstructural characterization,"Scanning-electron microscopy (SEM) was conducted, using a Zeiss Auriga 40 equipped with back-scattered electrons (BSE), and energy-dispersive X-ray spectroscopy (EDS). The SEM images were analyzed, using the ImageJ software [43] to obtain the volume fractions of dendrites and interdendrites, respectively. The surface morphology of the polished samples was studied by the electron-backscatter diffraction (EBSD) to indicate the presence of a single solid-solution phase and confirm the variation of the grain size and morphology after the heat treatment.",[],[]
2.3,Experimental methods.Microstructural characterization,"For the APT observation, needle-shaped specimens were made, using standard lift-out methods with an FEI Nova focused ion beam (FIB) [44,45]. The data collection was conducted, using a local electrode atom probe (CAMECA LEAP 4000X HR) equipped with an energy-compensating reflectron lens and a 10 pico-second 355 nm ultraviolet (UV)-pulsed laser. The specimen was cooled to 30 K, while a 50 pJ laser energy and a 200 kHz pulse repetition rate were used to evaporate ions with a detection rate of 0.005 ions per pulse. The data reconstruction and analysis were conducted, employing the IVAS 3.6.12 software (CAMECA instruments).",[],[]
2.4,Experimental methods.In-situ neutron-diffraction experiments,"In-situ neutron-diffraction (ND) measurements of as-cast and heat-treated NbTaTiV alloys with a specimen diameter of 4 mm and length of 8 mm under compression were performed to investigate the deformation behavior at room temperature (RT), using an MTS load-frame on the VULCAN Engineering Diffractometer at the Spallation Neutron Source (SNS), Oak Ridge National Laboratory (ORNL) [46,47]. The ND instrument utilizes the time-of-flight (TOF) arrangement, which allows for the ND measurements with a diffraction pattern, covering a wide range of d spacings without the rotation of samples or detectors. The VULCAN is equipped with two detectors, designated as Banks 1 and 2 at ± 90°. These two detectors were employed to record diffraction patterns corresponding to the lattice planes, which are parallel to the axial and transverse directions, respectively. The sample is illuminated by the incident neutron beam of a 3 × 3 mm2slit size and 2-mm collimators. During the measurement of the diffraction patterns, a constant load-control mode with a stepwise-loading sequence was utilized. The measurement time of the neutron-diffraction data was 20 min at each stress level. When the stress level reached 1100 MPa (close to the yield strength), the control mode was changed from the load to displacement control modes with an incremental step of 0.2 mm. The collected data were analyzed by single-peak fitting, using the VULCAN Data Reduction and Interactive Visualization software (VDRIVE) program [48].",[],[]
2.5,Experimental methods.Mechanical tests,"The mechanical experiments were carried out under uniaxial compression for the as-cast alloy at RT, as well as the heat-treated alloy at RT, 300 °C, 500 °C, 700 °C, 800 °C, and 900 °C, using a computer-controlled Material Test System (MTS) servo-hydraulic-testing machine. It was very difficult to obtain high-quality specimens without the cast flaws, such as pores using copper-mold drop casting. Alternatively, further processes, such as rolling, are necessary to remove the flaws. Indeed, the secondary processing, i.e., rolling, seems to be quite effective to eliminate the micro-flaws formed during solidification. However, the microstructure, such as the grain size of samples after secondary processing, will be significantly changed or modified from that of the as-cast microstructure. It is believed that uniaxial compression is a possible method to obtain the intrinsic mechanical properties of as-cast and heat-treated NbTaTiV refractory HEAs. The experiments were conducted at an initial strain rate of 10−3s−1with a specimen diameter of 4 mm and length of 8 mm (aspect ratio of 2:1). During the experiments at high temperatures, the test specimens were heated to the desired temperature by a furnace. Note that the mechanical test result is obtained from three to five repeated trials. All values of yield strengths and stress-strain curves are chosen as the representative data, which indicates the mean values of yield strengths. The repeated measurements of mechanical properties at elevated temperatures suggested that each set of tests show less than 8% deviation. The surface of the heat-treated specimen was polished to observe the surface-deformation morphology after 15% deformation.",[],[]
2.6,Experimental methods.First-principles calculations,"The total-energy calculations were performed, using the Viennaab initiosimulation package (VASP) [49] based on the density functional theory (DFT) with the projector augmented wave (PAW) [50,51] method. The Perdew-Burke Ernzerhof (PBE) [52] function under the non-spin polarized generalized gradient approximation (GGA) interaction is used to describe the exchange and correlation interaction. The kinetic energy cutoff of 500 eV for the plane-wave basis is employed. Using the Monkhorst-Pack scheme, the Brillouin zone integration is carried out at 5 × 5 × 5 k-points [53]. The convergence threshold for energy is 10−4eV, while the symmetry-unrestricted optimization for the geometry is performed, employing the conjugate gradient scheme until the residual force on each atom is less than 0.01 eV/Å.",[],[]
3.1,Results.Computational prediction of phase formation and evolution via the CALPHAD approach,"The CALPHAD calculations were used to predict the microstructure of the NbTaTiV alloy.Fig. 1shows the predicted equilibrium and non-equilibrium phase mole fraction versus temperature plots in the alloy system. A single BCC solid solution is predicted to form with the bulk composition of Nb23.8Ta25.5Ti24.9V25.8, atomic percent (at. %). The calculated liquidus and solidus temperatures are Tliq= 2161 °C and Tsol= 1941 °C, respectively. The BCC solid solution decomposes into a minor HCP phase at Tdec= 432 °C. The ratio of the temperature range where the BCC solid solution is stable over the solidus temperature [i.e.,(Tsol−Tdec)/Tsol] is determined to be 0.78. Gao et al. [54] previously proposed that a ratio greater than 0.30 typically favors a single-phase solid solution in the as-cast state.",['fig1'],[]
3.1,Results.Computational prediction of phase formation and evolution via the CALPHAD approach,"The non-equilibrium solidification was simulated, using the Scheil-Gulliver model [55], which assumes equilibrium mixing in the liquid state and no diffusion in the solid state. The simulation predicts the formation of a single BCC solid solution during the entire non-equilibrium solidification. Based on the evidence, the real solidification path is thought to be somewhere between the equilibrium and Scheil-Gulliver model. The simulation also predicts the chemical segregation associated with Ta, Ti, and V due to constitutional cooling. It is believed that as the temperature decreases, the BCC phase is rich in Ta at earlier stages of solidification in the dendrite arms, while the interdendritic region is enriched in Ti and V in later stages (the inset inFig. 1).",['fig1'],[]
3.2,Results.Chemical inhomogeneity in the as-cast sample,"Fig. 2(a) shows the scanning-electron microscopy (SEM) back-scattered electron (BSE) image of the as-cast NbTaTiV refractory HEA. The microstructure consists of dendritic and interdendritic regions without any secondary phase. The different contrast between the dendritic and interdendritic regions suggests that elemental segregation occurs during the solidification process. The elemental distributions and chemical compositions of dendritic and interdendritic regions in the as-cast alloy were examined by the energy-dispersive-spectroscopy (EDS) mapping and point EDS analysis (not shown). The dendrite is enriched in Nb and Ta, while Ti and V are more preferentially distributed in the interdendritic region, which is consistent with the CALPHAD calculation inFig. 1. The results of chemical compositions are summarized inTable 1.","['fig2', 'fig1']",['tbl1']
3.2,Results.Chemical inhomogeneity in the as-cast sample,"The neutron-diffraction (ND) pattern inFig. 2(b) reveals the formation of a single BCC phase without clear features related to the chemical segregation. Similarly, the EBSD-phase map inFig. 2(c) shows the presence of a single BCC solid-solution phase. These results indicate that the ND and EBSD techniques can properly characterize the crystallographic-based microstructural features, such as the phase formation and grain size.","['fig2', 'fig2']",[]
3.2,Results.Chemical inhomogeneity in the as-cast sample,"Atom probe tomography (APT) was performed to confirm the chemical homogeneity of the as-cast sample at the atomic scale and the composition of each region.Fig. 2(d) and (e) present elemental maps and one-dimensional concentration-depth data from the dendritic (bright contrast) and interdendritic (dark contrast) regions in analyzed volumes of 74 × 71 × 79 nm3and 81 × 76 × 114 nm3in the as-cast condition, respectively. The dendritic region was found to have a calculated composition of Nb 27.265, Ta 27.381, Ti 21.862, and V 22.150, at. %, while the interdendritic region had a calculated composition of Nb 20.997, Ta 11.669, Ti 33.149, and V 32.164, at. %.",['fig2'],[]
3.2,Results.Chemical inhomogeneity in the as-cast sample,"The homogeneity of the atomic distributions within the APT dataset was evaluated via the chi-squared statistics using a frequency distribution analysis (FDA) [56], in which compositions from 100 ion bins of the observed data were compared to a binomial distribution, which represents a random solid solution. The results of this analysis are presented in the inset ofFig. 2(d) and (e) with the experimental data (dots) overlaid on the theoretical binomial (random) distribution (solid line). The experimental results were in good agreement with the random binomial distribution, indicating random atomic arrangements within the atom-probe dataset. Theμvalue orχ2normalized to the sample size quantifies the extent of the elemental-distribution randomness. Only theμvalue is reported in this case (seeTable 1) due to the very large sample size, which causes theptest to be extremely sensitive to small variations. Theμvalue ranges from 0 to 1, with 0 indicating a complete random solid solution, and 1 representing a complete association of the elements. Theχ2statistics applied to the APT data, including theμvalue, are explained in more detail by Moody et al. [57] and Miller _ENREF_24_ENREF_24 [56]. One-dimensional concentration-depth profiles taken along a 10-nm cylindrical region further reflect that there are no statistically-significant concentration fluctuations in the dendritic and interdendritic regions, as shown inFig. 2(d) and (e). However, there are clear chemical-composition differences between the two regions. The dendritic region contains higher amounts of Nb and Ta elements, whereas the interdendritic region consists of higher amounts of Ti and V, which are consistent with the EDS results (Table 1), and CALPHAD prediction (Fig. 1).","['fig2', 'fig2', 'fig1']","['tbl1', 'tbl1']"
3.3,Results.Tailoring single phase with homogeneous chemistry via thermal treatment,"As an attempt to achieve a homogeneous single phase without the compositional segregation in the as-cast alloy, systematic thermal treatments have been conducted, based on the CALPHAD results (i.e., heat treatments at 1000 °C for 1 day, 1200 °C for 1 day, and 1200 °C for 3 days). As the homogenization temperature and duration increase, an apparent microstructural variation is observed, as shown inFig. 3(a–c). The dendrite-arm spacings and volume fractions of dendritic and interdendritic regions for the sample heat-treated at 1000 °C for 1 day are slightly larger [Fig. 3(a)] than those of the as-cast sample [Fig. 2(a)]. The quantitative difference of dendrite-arm spacings and volume fractions are summarized in each figure. This variation implies an insufficient diffusion at the above temperature. The heat treatment at 1200 °C for 1 day leads to the blurred contrast between dendrites and interdendrites [Fig. 3(b)], which indicates a gradual reduction of the compositional segregation.","['fig3', 'fig3', 'fig2', 'fig3']",[]
3.3,Results.Tailoring single phase with homogeneous chemistry via thermal treatment,"To obtain a fully-homogeneous elemental distribution, the sample was subjected to a longer heat treatment at 1200 °C. This thermal treatment results in the complete elimination of the dendritic segregation concomitant with the grain growth (grain sizes of 200–400 μm), as observed inFig. 3(c). The EDS measurements (not shown) were conducted to further confirm the homogeneous chemical distribution in the sample heat-treated at 1200 °C for 3 days. No formation of other phases along the grain boundary as well as inside the grain was observed. The specific chemical composition for the homogenized microstructure was investigated by the point EDS analysis. Importantly, each element was distributed as a nearly-equi-atomic percentage throughout the sample. The results of chemical compositions are summarized inTable 1. The ND pattern and EBSD-phase map show that there is no obvious formation of the secondary phase or phase transformation after the heat treatment [Fig. 3(d) and (e)].","['fig3', 'fig3']",['tbl1']
3.3,Results.Tailoring single phase with homogeneous chemistry via thermal treatment,"The atomic-scale distribution of elements for the homogenized sample was measured, using an analyzed volume of 63 × 61 × 75 nm3by APT. The APT results reveal a uniform distribution of alloying elements with near-equal atomic concentrations, as can be seen inFig. 3(f). The FDA inFig. 3(g) shows a good agreement between the experimental data and the binomial distribution [33,57]. Theμvalues, as discussed above, can be found inTable 1. Note that the APT-tip samples were extracted, adjacent to the grain-boundary region, to ensure a homogeneous elemental distribution, as secondary phases tend to precipitate along grain boundaries [58]. In short, the chemical segregation in the as-cast state was effectively eliminated by a systematic heat-treatment process, and the single-phase solid solution with the atomic-scale random elemental distribution was accomplished.","['fig3', 'fig3']",['tbl1']
3.4,Results.Mechanical properties at room and elevated temperatures,"Fig. 4(a) presents the compressive engineering stress-strain curves of the as-cast and homogenization-treated NbTaTiV alloys at RT with a strain rate of 1 × 10−3s−1. The yield strengths (σy) of the as-cast and heat-treated samples are comparable (as-cast: 1236 MPa, and heat-treated: 1273 MPa) without the fracture occurring at a compressive strain limit of 30%. The compression experiments at RT were carried out, using thein-situND to investigate the deformation behavior during elastic and plastic deformations.Fig. 4(b) and (c) exhibit the corresponding lattice-strain evolutions of {110} and {200} planes along the loading direction, as a function of the applied stress for the as-cast and homogenized samples, respectively. The lattice strains during loading,εhkl, are calculated from the shift of single-peak positions, using(1)εhkl=dhkl−dhkl,0dhkl,0wheredhklis the d-spacing obtained from thehkldiffraction at a given load, anddhkl,0refers to the value without the load. The lattice-strain evolution can provide the {hkl} plane-specific lattice strain during deformation. Generally, the {110}-oriented grains yield initially, because the {110} orientation is preferred for the slip in the BCC structure, and then the additional load transfers to {200}-oriented grains, resulting in the increase of the {200} lattice strain, which is known as load sharing or partitioning [59]. Our results obtained from both the as-cast and homogenized samples show the similar load-sharing trend, as observed in the conventional BCC alloys. However, the slopes of {110} and {200} lattice strains increase during the loading to 750–850 MPa, and 900–1000 MPa, respectively, in the as-cast condition. In contrast, the slopes for the homogenized state maintain a linear response until 1100 MPa.","['fig4', 'fig4']",[]
3.4,Results.Mechanical properties at room and elevated temperatures,"The lattice-strain evolutions for {110} and {200} grains reveal that the stress value for the elastic-plastic transition of the as-cast sample (∼1000 MPa) is slightly lower than the homogenized one (∼1100 MPa), which is consistent with the engineering stress-strain behavior [Fig. 4(a)].Fig. 4(d) and (e) illustrate the variations in the normalized peak width (W/W0) of {110}, {200}, {211}, and {310} peaks as a function of engineering strain. Note that the reference peak width (W0) was taken at the initial diffraction pattern (before the applied stress). For both conditions, no significant changes of peak widths were observed during elastic deformation. After yielding, however, the peak widths of the homogenized sample [Fig. 4(e)] increase more considerably than those of the as-cast one during plastic deformation. The width increase could be associated with the stress-induced heterogeneous substructure, such as distortion and twining [60,61]. However, based on our examination concerning the lateral surface of the 15% deformed specimens using SEM and EBSD as shown inFig. 5(a–c), a number of slip bands are observed without the formation of twin bands. These results indicate that the plastic-deformation behavior is mainly dominated by the dislocation-slip mechanism, and during the deformation of the homogenized sample, more dislocations are produced as the plastic deformation proceeds.","['fig4', 'fig4', 'fig4', 'fig5']",[]
