Table ID,Table Path,Table Label,Table Caption,Table Footer
t0005,C:\Users\D. Sai Mani Kumar\Downloads\XML_Extractor\articles_test\10.1016.j.matdes.2015.05.019\tables\Table 1.csv,Table 1,Chemical compositions (at.%) of MoNbHfZrTi alloy in as-cast state.,
t0010,C:\Users\D. Sai Mani Kumar\Downloads\XML_Extractor\articles_test\10.1016.j.matdes.2015.05.019\tables\Table 2.csv,Table 2,"Compressive properties of maximum strength, sp
, yield strength, s
0.2, and fracture strain, d at different temperatures.",
t0015,C:\Users\D. Sai Mani Kumar\Downloads\XML_Extractor\articles_test\10.1016.j.matdes.2015.05.019\tables\Table 3.csv,Table 3,"Characteristics of Nb, Mo, Ti, Zr, Hf (A2: BCC, A3: HCP, the lattice parameter of BCC crystal structure at room temperature [15]).",
t0020,C:\Users\D. Sai Mani Kumar\Downloads\XML_Extractor\articles_test\10.1016.j.matdes.2015.05.019\tables\Table 4.csv,Table 4,"The values of mixing enthalpy (DH
mix, KJ/mol) calculated by Miedema's model for binary atomic pairs.",
