Figure ID,Figure Path,Figure Label,Figure Caption
f0005,articles_test/10.1016.j.msea.2015.10.071/figures/gr1.jpg,Fig. 1,"Microstructures SEM of a) ternary Sc33Ti33Zr33 alloy, b) quaternary Nb25Sc25Ti25Zr25 HEA."
f0010,articles_test/10.1016.j.msea.2015.10.071/figures/gr2.jpg,Fig. 2,X-ray diffraction pattern of the as cast and annealed at 1000˚C/24h Nb25Sc25Ti25Zr25 HEA with two marked phases with hexagonal and cubic structures.
f0015,articles_test/10.1016.j.msea.2015.10.071/figures/gr3.jpg,Fig. 3,TEM-BF image of Nb25Sc25Ti25Zr25 HEA with marked places of chemical analysis.
f0020,articles_test/10.1016.j.msea.2015.10.071/figures/gr4.jpg,Fig. 4,"TEM observations of Nb25Sc25Ti25Zr25 HEA, a) BF image of plates with SAED pattern, b) DF at [0001] zone axis, showing regions of α(Sc, Zr) with hexagonal structure in bright contrast, c) BF image with SAED pattern from area between laths, d) DF-TEM along the [001] zone axis, showing bright contrast from cubic structure of β-NbTiZr."
f0025,articles_test/10.1016.j.msea.2015.10.071/figures/gr5.jpg,Fig. 5,"Qualitative EDS chemical analysis of Nb25Sc25Ti25Zr25 alloy, a) STEM image with place of analysis inside large frame, and corresponding distribution maps of b) Nb-map, c) Sc, c) Ti, e) Zr."
f0030,articles_test/10.1016.j.msea.2015.10.071/figures/gr6.jpg,Fig. 6,"Results of microstructure study of Nb25Sc25Ti25Zr25 alloy after annealing at 1000˚C for 24h; a) SEM-BSE image with marked points of EDS analysis, b) TEM-BF from interface area between two phases."
f0035,articles_test/10.1016.j.msea.2015.10.071/figures/gr7.jpg,Fig. 7,"Qualitative EDS chemical analysis of Nb25Sc25ti25Zr25 high entropy alloy after annealing at 1000˚C/ 24h; a) STEM image with place of analysis inside large frame; distribution maps of b) Nb, c) Sc, d) Ti and e) Zr."
f0040,articles_test/10.1016.j.msea.2015.10.071/figures/gr8.jpg,Fig. 8,Compression curves of Nb25Sc25Ti25Zr25 HAE; as cast (solid line) and after annealing at 1000˚C/24h (dashed line).
f0045,articles_test/10.1016.j.msea.2015.10.071/figures/gr9.jpg,Fig. 9,TEM-BF image of Nb25Sc25Ti25Zr25 HEA compressed up to 1.2GPa.
