Figure ID,Figure Path,Figure Label,Figure Caption
fig1,articles_test/10.1016.j.jallcom.2016.11.188/figures/gr1.jpg,Fig. 1,"(a) Calculated equilibrium phase mole fraction versus temperature for Mo19.1Nb20.2Ta21Ti21.3V18.3. (b)–(d) Non-equilibrium solidification using Scheil–Gulliver models: (b) Mole fraction of BCC phase, (c) liquid phase composition, and (d) BCC phase composition."
fig2,articles_test/10.1016.j.jallcom.2016.11.188/figures/gr2.jpg,Fig. 2,(a) XRD pattern of the as-cast MoNbTaTiV alloy. (b) Backscattered electron SEM micrograph of the polished cross-section.
fig3,articles_test/10.1016.j.jallcom.2016.11.188/figures/gr3.jpg,Fig. 3,"Backscattered electron SEM micrograph and EDX mapping of elements Ta, Mo, Nb, V, and Ti in the as-cast MoNbTaTiV alloy."
fig4,articles_test/10.1016.j.jallcom.2016.11.188/figures/gr4.jpg,Fig. 4,"The correlation between the partition coefficient,K=Cdr/Cidr, and the difference,ΔT=(Tm)i−Tmmix."
fig5,articles_test/10.1016.j.jallcom.2016.11.188/figures/gr5.jpg,Fig. 5,"Compressive engineering stress-strain curves for the as-cast MoNbTaTiV, MoNbTaV, NbTaTiV, NbTaVW, and NbTaTiVW alloys at room temperature."
fig6,articles_test/10.1016.j.jallcom.2016.11.188/figures/gr6.jpg,Fig. 6,"Mechanical properties of single BCC refractory HEAs: (a)σ0.2expvs.HVexp/3, (b)σ0.2calvs.σ0.2expand (c)HVcalvs.HVexp."
fig7,articles_test/10.1016.j.jallcom.2016.11.188/figures/gr7.jpg,Fig. 7,"Predicted mechanical properties of HfMoxNbTaTiZr: (a) Yield strength and hardness, (b) the atomic size mismatch|δri|, (c) the shear modulus mismatch|δGi|, and (d) total solid solution strengthening magnitude."
fig8,articles_test/10.1016.j.jallcom.2016.11.188/figures/gr8.jpg,Fig. 8,"(a) 125-atom SQS cell of BCC MoNbTaTiV after full relaxation (Mo: Puce; Nb: green; Ta: blue; Ti: black; V: red). (b) Total energy versus atomic volume for BCC MoNbTaTiV and its constituent elements. (c) Atomic volume. (d) Bulk modulus. (e) Shear modulus. The average values, indicated by the lines in (c)–(e) are calculated using the ROM. The experimental values for the pure elements are taken from Ref.[66].B|eos,B|Cij, andB|Expstand for bulk modulus from EOS, elastic constants, and experiments, respectively. (For interpretation of the references to colour in this figure legend, the reader is referred to the web version of this article.)"
