Section Heading,Section Title,Paragraph,Figures,Tables
3.3.2,Results and discussion.Mechanical properties.Compressive strength,"Another interesting approach to improving mechanical properties is to design an EHEA alloy with lamellar “eutectic-like” micro-structure composed of alternating soft FCC and hard BCC[42]. This was demonstrated for AlCoCrFeNi2.1where the as-cast mode possessed fine alternating FCC and ordered BCC phase (B2) layers. Accordingly, high strength combined with large elongation, as well as stability to relatively high temperatures (700 °C), was obtained. This type of micro-structure can be regarded as a fine composite material.",[],[]
3.3.2,Results and discussion.Mechanical properties.Compressive strength,"SEM images illustrating crack propagation in the specimens treated at 850 and 975 °C and compressed until fracture are given inFig. 7. The cracks propagated in ID regions or near the interface of the DC and ID regions ( Figs. 7 a and b) and usually terminated when the crack tip reached the DC region (Fig. 7c). Higher magnification images ( Figs. 7 d and e) indicated that the cracks mainly propagated through the dark matrix, likely corresponding to the brittle σ phase. The AlCoCrFeNi alloy can thus be considered as a “macro-” composite material, like the AlCoCrFeNi2.1alloy[42], in which strength is attained by the strong and brittle ID regions and ductility is gained by the DC regions, which are relatively soft.","['fig7', 'fig7', 'fig7', 'fig7']",[]
3.3.2,Results and discussion.Mechanical properties.Compressive strength,"We found that heat treatment of 3 h at 1200 °C homogenized the alloy albeit not completely (Figs. 4d and 5d). Such treatment markedly improved the mechanical properties (Table 6) due to the dissolving the majority of the existing phases and the creation of very small nano-precipitates (even smaller than the phases in the as-cast mode due to higher cooling rates). To improve further the mechanical properties, we are now investigating the impact of a higher homogenization temperature (1275 °C) followed by additional heat treatment to tailor the desired mechanical properties. Further improvement could involve performing HIP at elevated temperatures, followed by heat treatment. In addition, identification of the different phases generated by high resolution TEM is in progress.","['fig4', 'fig5']",['tbl6']
4,Summary,"The impact of heat treatment on AlCoCrFeNi alloy micro-structure and mechanical properties was investigated using SEM, XRD, compressive tests and Vickers micro-hardness measurements. The following results were obtained:1)The alloy solidified dendritically with DC regions presenting an average composition of 45.3 at.% Ni + Al and 54.7 at.% Co + Cr + Fe, while ID regions were enriched in Co, Cr and Fe (35.5 at.% Ni + Al and 64.5 at.% Co + Cr + Fe). The micro-structure of the DC regions consisted of a soft matrix (micro-hardness of 4.6 GPa), probably corresponding to an undetectable few vol% FCC structure with hard nano-sized precipitates, while the ID region consisted of a BCC matrix with hard nano-sized precipitates.2)Heat treatment at temperatures at 850 °C caused transformation of the BCC matrix into the brittle σ phase, with micro-hardness of the ID region increasing drastically. Heat treatment at 975 °C caused the σ phase to transform back to the BCC matrix, which caused alloy softening, resulting in decreased micro-hardness and increased elongation.3)During solid cooling after solidification or cooling after heat treatment between 1200 and 1100 °C, spinodal decomposition took place in both the DC and ID regions. In the DC regions, the super-saturated solid solution decomposed to a relatively soft matrix and small precipitations, while in the ID region, a hard BCC matrix and B2 precipitates formed. The combination of a relatively soft DC and hard and brittle ID regions provided a unique high compression strength combined with large contraction. The alloys with solely a BCC/B2 structure displayed high strength and low contraction.4)Cracks initiated and propagated in hard ID regions or near the interface of the DC and ID regions. Usually, these terminated when the crack tip reached the ductile DC region.5)The homogenization temperature for AlCoCrFeNi alloy should be above 1200 °C. At this temperature, the majority of the phases are dissolved. Upon cooling, the specimen re-enters the miscibility gap which is around 1200 °C and decomposes into two type precipitates. As a result, the compressive strength, as well as the compressive contraction, increased.",[],[]
4,Summary,"The alloy solidified dendritically with DC regions presenting an average composition of 45.3 at.% Ni + Al and 54.7 at.% Co + Cr + Fe, while ID regions were enriched in Co, Cr and Fe (35.5 at.% Ni + Al and 64.5 at.% Co + Cr + Fe). The micro-structure of the DC regions consisted of a soft matrix (micro-hardness of 4.6 GPa), probably corresponding to an undetectable few vol% FCC structure with hard nano-sized precipitates, while the ID region consisted of a BCC matrix with hard nano-sized precipitates.",[],[]
4,Summary,"Heat treatment at temperatures at 850 °C caused transformation of the BCC matrix into the brittle σ phase, with micro-hardness of the ID region increasing drastically. Heat treatment at 975 °C caused the σ phase to transform back to the BCC matrix, which caused alloy softening, resulting in decreased micro-hardness and increased elongation.",[],[]
4,Summary,"During solid cooling after solidification or cooling after heat treatment between 1200 and 1100 °C, spinodal decomposition took place in both the DC and ID regions. In the DC regions, the super-saturated solid solution decomposed to a relatively soft matrix and small precipitations, while in the ID region, a hard BCC matrix and B2 precipitates formed. The combination of a relatively soft DC and hard and brittle ID regions provided a unique high compression strength combined with large contraction. The alloys with solely a BCC/B2 structure displayed high strength and low contraction.",[],[]
4,Summary,"Cracks initiated and propagated in hard ID regions or near the interface of the DC and ID regions. Usually, these terminated when the crack tip reached the ductile DC region.",[],[]
4,Summary,"The homogenization temperature for AlCoCrFeNi alloy should be above 1200 °C. At this temperature, the majority of the phases are dissolved. Upon cooling, the specimen re-enters the miscibility gap which is around 1200 °C and decomposes into two type precipitates. As a result, the compressive strength, as well as the compressive contraction, increased.",[],[]
