Table ID,Table Path,Table Label,Table Caption,Table Footer
tbl1,C:\Users\D. Sai Mani Kumar\Downloads\XML_Extractor\articles_test\10.1016.j.jallcom.2016.05.034\tables\Table 1.csv,Table 1,Nominal and actual compositions (at. %) of the AlCoCrFeNi alloy used in this investigation as measured using EDS analysis from more than 20 different places and locations. The measurement accuracy is +-0.4 at. %.,
tbl2,C:\Users\D. Sai Mani Kumar\Downloads\XML_Extractor\articles_test\10.1016.j.jallcom.2016.05.034\tables\Table 2.csv,Table 2,Compositions (at. %) of the dendritic core and the inter-dendrite regions of the as cast AlCoCrFeNi alloy. The measurement accuracy is +-0.4 at. %.,
tbl3,C:\Users\D. Sai Mani Kumar\Downloads\XML_Extractor\articles_test\10.1016.j.jallcom.2016.05.034\tables\Table 3.csv,Table 3,A summary of the micro-structural observations and phases detected by XRD analysis in the DC and ID regions.,
tbl4,C:\Users\D. Sai Mani Kumar\Downloads\XML_Extractor\articles_test\10.1016.j.jallcom.2016.05.034\tables\Table 4.csv,Table 4,Compositions (at. %) of the different phases in the ID region (the points refers to Fig. 5). The measurement accuracy is +-0.4 at. %.,
tbl5,C:\Users\D. Sai Mani Kumar\Downloads\XML_Extractor\articles_test\10.1016.j.jallcom.2016.05.034\tables\Table 5.csv,Table 5,A summary of the micro-hardness of the alloy in the as-cast condition and after various heat treatments for AlCoCrFeNi alloy.,
tbl6,C:\Users\D. Sai Mani Kumar\Downloads\XML_Extractor\articles_test\10.1016.j.jallcom.2016.05.034\tables\Table 6.csv,Table 6,"A summary of the compressive yield stress, compressive maximum stress and compressive uniform contraction for the AlCoCrFeNi alloy in the as-cast condition and after different heat treatments.",
tbl7,C:\Users\D. Sai Mani Kumar\Downloads\XML_Extractor\articles_test\10.1016.j.jallcom.2016.05.034\tables\Table 7.csv,Table 7,A summary of the mechanical properties published for AlCoCrFeNi alloy compared to the result obtained in the current work.,
