Section Heading,Section Title,Paragraph,Figures,Tables
0,Abstract,"Recent studies indicate that eutectic high-entropy alloys can simultaneously possess high strength and high ductility, which have potential applications in industrial fields. Nevertheless, microstructural origins of the excellent strength–ductility combination remain unclear. In this study, an AlCoCrFeNi2.1 eutectic high-entropy alloy was prepared with face-centered cubic (FCC)(L12)/body-centered-cubic (BCC)(B2) modulated lamellar structures and a remarkable combination of ultimate tensile strength (1351 MPa) and ductility (15.4%) using the classical casting technique. Post-deformation transmission electron microscopy revealed that the FCC(L12) phase was deformed in a matter of planar dislocation slip, with a slip system of {111} <110>, and stacking faults due to low stacking fault energy. Due to extreme solute drag, high densities of dislocations are distributed homogeneously at {111} slip plane. In the BCC(B2) phase, some dislocations exist on two {110} slip bands. The atom probe tomography analysis revealed a high density of Cr-enriched nano-precipitates, which strengthened the BCC(B2) phase by Orowan mechanisms. Fracture surface observation revealed a ductile fracture in the FCC(L12) phase and a brittle-like fracture in the BCC(B2) lamella. The underlying mechanism for the high strength and high ductility of AlCoCrFeNi2.1 eutectic high-entropy alloy was finally analyzed based on the coupling between the ductile FCC(L12) and brittle BCC(B2) phases.",[],[]
1,Introduction,"High-entropy alloys (HEAs), which emerged in 2004, are solid solution multicomponent alloys that contain more than four principal elements in equal or non-equal atomic percentage[1–5]. HEAs are a new kind of alloys because they are different from conventional alloys that have one or two principal elements as main components. HEAs have attracted increasing attention recently due to their unique atomic structure and properties, such as high strength of body-centered-cubic (BCC) AlCoCrFeNi alloy at room temperature and TaNbHfZrTi alloy at elevated temperatures, high ductility of face-centered cubic (FCC) CrMnFeCoNi alloy and transformation-induced plasticity-assisted meta-stable dual-phase Fe50Mn30Co10Cr10alloy, sluggish diffusion, and high thermal stability[6–17].",[],[]
1,Introduction,"The review of literature indicates that two kinds of HEAs have been widely investigated in the last 10 years: single-phase FCC HEAs and BCC HEAs. Single-phase FCC HEAs generally have high tensile ductility but low yield strength. Examples are CrMnFeCoNi alloy with an elongation to failure of ∼50% and yield strength of ∼410 MPa[7], Fe40Mn40Co10Cr10alloy with a tensile ductility of ∼58% and low yield strength of ∼240 MPa[17], and Fe40Mn26Ni27Co5Cr2alloy with a total elongation to failure of ∼58% and low yield strength of ∼95 MPa at room temperature[18]. However, BCC HEAs have high yield strength but low ductility. For example, [316]-oriented and [001]-oriented Nb25Mo25Ta25W25single crystalline pillars have an extraordinarily high strength level (about 4–4.5 GPa) but low plasticity (less than 0.2%)[19]. Therefore, for the single-phase HEAs, it seems difficult to achieve a balance between high strength and high ductility. In addition, the industrial applications of HEAs are restricted certainly by poor castability, liquidity, and composition segregation.",[],[]
1,Introduction,"Recently Lu et al.[20]proposed a designation concept of eutectic high-entropy alloys (EHEAs) to combine the high strength of BCC HEAs and high ductility of FCC HEAs and produced an AlCoCrFeNi2.1EHEA with regular FCC(L12)/BCC(B2) lamellar structures and an excellent combination of high strength and high ductility. More recently, the mechanical properties of AlCoCrFeNi2.1EHEA were optimized by thermal mechanical processes, that is, multi-pass cold rolling to a 90% reduction in thickness and subsequently annealed at 800–1200 °C for 1 h[21,22]. As a result, the processed HEAs had tensile ductility more than 10% and high tensile strength greater than 1 GPa. This indicated that the properties of the EHEA could be successfully tailored using thermo-mechanical processing for a wide range of engineering applications. However, the microstructural origins of excellent strength–ductility combination and underlying deformation mechanisms of EHEAs still need systematic investigations.",[],[]
1,Introduction,"In this study, transmission electron microscopy (TEM) and atom probe tomography (APT) were used to systematically characterize the microstructural characteristics of post-deformed AlCoCrFeNi2.1EHEA to find answers to the aforementioned problems.",[],[]
2,Experiments,"The master alloy of the eutectic AlCoCrFeNi2.1(elements in atomic ratios) was prepared from commercially pure elements (99.9 wt% for Al, Co, and Ni; 99.5–99.6 wt.% for Cr and Fe) in a ZrO2crucible of a vacuum induction melting furnace. The ZrO2crucible was first heated to 600 °C and held for 1 h to remove the water vapor. After the elements (approximately 2.5 kg) were put into the furnace, the furnace chamber was evacuated to 0.06 Pa and backfilled with high-purity argon gas to reach 0.06 MPa. The elements were finally melted, superheated, and poured into a high-purity graphite crucible with an inner length of 220 mm, upper inner diameter of 62 mm, and bottom inner diameter of 50 mm. The pouring temperature was set to be 1500 °C. A TRTM-2CK infrared pyrometer was used to monitor the temperature with an absolute accuracy of±2 °C. A Walter + bai LFM 20 kN tensile testing machine was used for tensile testing at room temperature with a normal strain rate of 1 × 10−3s−1. The flat dog bone-shaped tensile samples had a gauge dimension of 20 × 3 × 2 mm3. The strain was measured using a standard non-contacting video extensometer. Three tensile specimens were measured to obtain reliable results.",[],[]
2,Experiments,"Microstructure and composition analyses were carried out by means of x-ray diffraction (XRD), electron back-scattered diffraction (EBSD), TEM, and APT. Specifically, the XRD analyses of crystalline structures were performed on a Bruker D8 with Cu radiation target scanning 2θ from 20 to 80°. EBSD of as-cast specimen was conducted using a high-resolution field emission Carl Zeiss-Auriga-45-66 scanning electron microscope (SEM) equipped with a fully automatic Oxford Instruments Aztec 2.0 EBSD system (channel 5 software). Before EBSD, the specimens were mechanically polished and then electro-polished in an electrolyte containing 90 vol.% acetic acid and 10 vol.% perchloric acid using a voltage of 50 V and polishing time of 45 s in Buehler electromet-4. TEM observations were conducted in a FEI-Tecnai G220 S-TWIN microscope operated at 200 kV, and the high-resolution TEM (HRTEM) was conducted on a Titan G2 60-300. TEM specimens were prepared as follows: the tensile deformed gauge parts were carefully ground to foils with a thickness of about 50 μm, punched into disks with a diameter of 3 mm, and finally electro-polished to an electron-transparent thickness in an aqueous electrolyte containing 10% perchloric acid and 90% ethanol at −25 °C using a twin-jet polishing system. The HRTEM specimen was prepared by means of ion milling on a GATAN 691 to avoid the different electro-polishing rates of the two eutectic phases.",[],[]
2,Experiments,"The APT specimen was prepared by electro-polishing combined with a focus iron beam (FIB) cutting along the phase interface. A low-energy (5 keV) Ga beam was used for final ion milling to minimize beam damage. The APT experiment was performed with a local electrode atom probe (LEAP 4000X Si) under ultraviolet laser pulsing at a laser energy of 40 pJ, a pulse repetition rate of 200 kHz, and a target evaporation rate of 0.5% per pulse at 25 K. APT data reconstruction and quantitative analysis were performed using a CAMECA visualization and analysis software (IVAS) 3.6.8.",[],[]
3.1,Results.Initial structures and tensile testing results,"Fig. 1a shows the XRD pattern of the as-cast AlCoCrFeNi2.1alloy. The as-cast AlCoCrFeNi2.1alloy consisted of FCC(L12) and BCC(B2) dual-phase. The L12and B2 structures, which were further confirmed by subsequent TEM-SAEDs (select area electron-beam diffraction patterns), were consistent with the results reported in the literature[21,22].Fig. 1b shows the large-area EBSD phase mapping of typical FCC(L12)/BCC(B2) lamellar microstructures. Fine BCC(B2) lamellae (about 2 μm thick, yellow color) were parallel to each other and distributed in the FCC(L12) phase (cyan color). In addition, some coarse BCC(B2) lamellae and islands also appeared. The volume fraction of FCC(L12) and BCC(B2) phases was about 66.3% and 31.2%, respectively. Moreover, some amounts of high-angle grain boundaries (marked in red) were formed during casting.","['fig1', 'fig1']",[]
3.1,Results.Initial structures and tensile testing results,"Tensile testing showed that the as-cast AlCoCrFeNi2.1alloy possessed an excellent combination of high strength and high ductility owing to the uniform FCC(L12)/BCC(B2) lamellar microstructures.Fig. 2shows the tensile engineering and true stress–strain curves of the as-cast AlCoCrFeNi2.1alloy. It is evident that the ultimate tensile stress was 1100±50 MPa and the ductility was 18±2%. When the engineering stress–strain curve (blue line) was converted into a true stress–strain curve (red line), the ultimate tensile stress and ductility were 1351 MPa and 15.4%, respectively.",['fig2'],[]
3.2.1,Results.Deformation mechanisms via TEM characterizations.Deformation of FCC(L12) phase,"TEM observations were performed to reveal the deformation mechanisms and understand the mechanical properties.Fig. 3a shows a representative bright-field TEM micrograph of the tensile tested AlCoCrFeNi2.1EHEA. Distinct modulated FCC(L12) and BCC(B2) lamellar structures were obviously observed based on different contrasts (bright and dark, respectively) in the TEM image. This was because the FCC(L12) phase was thinner than the BCC(B2) phase after twin-jet polishing. This chemical polishing result also suggested that the corrosion resistance of BCC(B2) phase was better than that of FCC(L12) phase.Fig. 3b and c show the TEM-SAEDs of FCC(L12) and BCC(B2) phases, respectively. The presence of super-lattice spots obtained from the two phases (marked by cyan and yellow circles, respectively) revealed both ordered L12(Fig. 3b) and B2 (Fig. 3c) phases. The formation of ordered L12structure is rarely reported in eutectic alloys in the literature, whereas the formation of ordered B2 phase is frequently reported owing to the strong negative enthalpy in the Al–Ni system[23–25]. The compositions of the present B2 phase were revealed as ∼38 at.% Ni and ∼37 at.% Al by the following APT analysis (seeTable 1), which hinted that Ni and Al atoms alternately occupied the lattice sites in the B2 unit cell, and other element atoms were substitutional solution atoms[26–28].","['fig3', 'fig3', 'fig3', 'fig3']",['tbl1']
3.2.1,Results.Deformation mechanisms via TEM characterizations.Deformation of FCC(L12) phase,"The deformation mechanisms of FCC(L12) and BCC(B2) phases were different from each other.Fig. 3d is a magnified TEM image of FCC(L12) phase region marked “A” inFig. 3a. Several arrays of parallel mobile dislocations could be discerned, as pointed by the white arrows. The specimen tilting technique[29]was used to determine the slip plane of parallel dislocations, and as a result, the dislocation glide was clearly localized on a distinct set of {111} type FCC lattice planes. From the density of parallel dislocations in the array, one could judge that the dislocations were emitted from the FCC(L12)/BCC(B2) phase boundaries. Besides high-density parallel dislocations in the FCC(L12) phases, the presence of some stacking faults (SFs, marked by black arrows inFig. 3d) was worth noting.Fig. 3e is a magnified TEM image of FCC(L12) phase region “B” inFig. 3a. One can observe some (1¯11) slip traces through the FCC(L12) lamella. The distance between the slip traces was about 250 nm. In addition, two kinds of {111} slip traces were also observed to intersect with each other (Fig. 4b).","['fig3', 'fig3', 'fig3', 'fig3', 'fig3', 'fig4']",[]
3.2.1,Results.Deformation mechanisms via TEM characterizations.Deformation of FCC(L12) phase,"The parallel unit dislocations, partial dislocations (SFS), and long straight (111) slip traces indicated that the dislocations glided in a manner of planar slip in the FCC(L12) phase. The slip traces running through the FCC(L12) lamella revealed that massive dislocations could be motivated on an FCC(L12)/BCC(B2) phase boundary and slipped on their initial slip planes to the opposite side of the phase boundary without cross-slip. The planar slip nature of the FCC(L12) phase resulted from the low stacking fault energy (SFE), which was further evidenced by the appearance of SFs[30,31]. Alternatively, the cross-slip usually occurred in metals with high SFE, such as pure Ni, Cu, and Al. The planar-slip in the FCC(L12) phase and the pinning effect from the FCC(L12)/BCC(B2) phase boundaries enhanced the strain hardening/dislocation accumulation capability and therefore resulted in the high tensile ductility and high ultimate tensile strength of AlCoCrFeNi2.1.",[],[]
3.2.2,Results.Deformation mechanisms via TEM characterizations.Deformation of BCC(B2) phase,"Fig. 4shows bright-field TEM images of the tensile tested EHEA specimen from an alternative region. The BCC(B2) phase had a medium density of dislocations after tension deformation and high density of nano-precipitates (Fig. 4c and d) (composition and structure characterized in the following section). The detailed analysis indicated that the dislocations in the B2 phase could be observed at the [001] zone axis and were mostly located in two slip bands, as displayed more clearly inFig. 5a. These dislocations were identified in (1¯10) and (110) slip bands, whose two specific directions intersected at 90°[32]. This result was different from the observation in a B2-ordered Al28Co20Cr11Fe15Ni26alloy where two {112} slip bands intersected at 30°[33]. Both bands contained straight and approximately parallel dislocations, which staggered on each other. Nevertheless, these dislocations did not tangle to form a network. Moreover, these dislocations were pinned by the nano-precipitates by leaving a region (marked with a white ellipse) lacking dislocations. Besides parallel dislocation lines, arrow-shaped (marked by white arrows) dislocations in B2 phases were also found (Fig. 5b). The arrow-shaped dislocations were formed in the following manner: when two straight parallel dislocations were pinned by a nano-precipitate on the tip, the contraction acquired an arrow shape. This result indicated that the precipitate-strengthening effect played an important role in the high strength of B2 phase.","['fig4', 'fig4', 'fig5', 'fig5']",[]
3.2.2,Results.Deformation mechanisms via TEM characterizations.Deformation of BCC(B2) phase,"Briefly, the FCC(L12) phase deformed via dislocation planar slip and SFs to act as a soft phase, whereas the B2 phase acted as a hard phase reinforced by nano-precipitates. The modulated hard and soft fine, regular eutectic lamellar structures of AlCoCrFeNi2.1EHEA created the excellent combination of high strength and high ductility.",[],[]
3.3,Results.Nano-precipitates by APT characterization,"The tip specimen was cut by FIB and analyzed by APT analysis to discover the composition of nano-precipitates in the B2 matrix phase. The 3-D atom maps are shown inFig. 6a. The tip specimen contained a clear phase boundary with both sides containing different elemental distributions (marked with black arrows). Compositions of FCC(L12) and B2 phases are given inTable 1. The FCC(L12) phase comprised Co, Cr, and Fe elements, while the B2 phase comprised Al and Ni elements. Moreover,Fig. 6a also reveals substantial spherical nano-precipitates enriching Cr atoms with sizes less than 20 nm in the B2 phase.Fig. 6b further shows a size distribution of Cr-enriched nano-precipitates. The proportion of Cr-enriched nano-precipitates with sizes less than 5 nm was more than 60% and that of nano-precipitates with sizes bigger than 10 nm was 11% (Fig. 6c).","['fig6', 'fig6', 'fig6', 'fig6']",['tbl1']
3.3,Results.Nano-precipitates by APT characterization,"The quantitative composition analyses of nano-precipitates and BCC as well as FCC phases were further conducted.Fig. 7a is the 1-D proxigram of nano-precipitates showing elemental concentration profiles along the radial direction of their iso-surfaces. The position atX= 0 was the interface (defined by the isosurface) of nano-precipitates and B2 matrix, whereas the positions atX> 0 andX< 0 were nano-precipitate interiors and B2 matrix, respectively. TheYvalues were average concentration values of all measured nano-precipitates in the B2 phase. Only the Cr concentration curve was seen to rise dramatically from ∼3 at.% to ∼80 at.% from matrix to nano-precipitate interiors, whereas the other elements (Al, Co, Fe, and Ni) tended to decrease: Al atoms reduced from ∼34 at.% to ∼6 at.%, Co atoms from ∼13 at.% to ∼3 at.%, Fe atoms from ∼10 at.% to ∼8 at.%, and Ni atoms from ∼40 at.% to ∼2 at.%. The aforementioned result indicated that the nano-precipitate was composed of dominant Cr with minor other elements.Fig. 7b shows 1-D concentration profiles of BCC and FCC phase regions. The concentration variations of all elements were sharp at the phase boundary.Fig. 8further shows a 3-D atom map (a) and corresponding 1-D concentration profile (b) for a specific nano-precipitate. The nano-precipitate was deficient in Al, Co, and Ni elements but rich in Fe and Cr. The Fe element concentration rose from ∼8 at.% to ∼12 at.% (at the analyzed position of ∼–0.5 nm) and then reduced to ∼7 at.% when the analyzed position changed from 0 to 4 nm. Cr element reached the highest value of ∼80 at.% at the analyzed position of ∼1 nm. The Fe enrichment zone indicated the existence of a thin compositional layer surrounding the Cr-enriched nano-precipitates. The presence of BCC nano-precipitates inside the B2 phase was observed in the Al0.7CoCrFeNi[34]and AlCoCrCuFeNi[35]HEAs, which originated from the spinodal decomposition of compositional modulation[22]. However, the Cr-enriched nano-precipitates with the special structure inside the B2 phase were first detected in the AlCoCrFeNi2.1EHEAs.","['fig7', 'fig7', 'fig8']",[]
3.4,Results.SFs and phase boundary by HRTEM characterization,"The qualitative characterization of SFs and atomic structures of eutectic dual phases was performed by HRTEM.Fig. 9a is an HRTEM micrograph showing three SFs in the FCC(L12) phase at [110] zone axis, andFig. 9b shows a magnified HRTEM image. The inset shows corresponding fast Fourier transformation patterns where weak contrast at the positions of L12order diffraction could be seen. The SFs were typical (1¯11) systems in the FCC phase formed by mobile 1/6<1¯12> Shockley partials. Moreover, two intersected (1¯11) and (11¯1) SFs were observed in the other regions of FCC(L12) phase, as shown inFig. 9c. These results indicated that the SF was another important deformation mode besides planar-slip aforementioned in the FCC(L12) phase.","['fig9', 'fig9', 'fig9']",[]
3.4,Results.SFs and phase boundary by HRTEM characterization,"HRTEM also uncovered the semi-coherent phase boundary between FCC(L12) and BCC(B2) phases (Fig. 9c). Therefore, the combination of eutectic dual phases was at the atomic level and strong enough to bear high stress. The AlCoCrFeNi2.1EHEA with a semi-coherent interface might possess the important value of engineering application in fields of high-temperature creep resistance and high elastic strain energy. Finally, HRTEM was used to uncover the structure of Cr-enriched nano-precipitates (Fig. 9d). A nano-precipitate of about 20 nm in diameter was marked in white spots with the zone axis of [110]. The (11¯0) and (002) planes of BCC matrix were seen to be perfectly coherent with the nano-precipitate.","['fig9', 'fig9']",[]
3.5,Results.Fracture mechanisms,"SEM observations were performed on the fracture surfaces to further understand the mechanical property and microstructure relationship as well as fracture mechanisms of dual-phase EHEA(Fig. 10). One could clearly distinguish two different kinds of fracture modes: ductile fracture in the FCC(L12) phase and brittle-like fracture in the BCC(B2) phase. Because the BCC(B2) phase had 3-D spatial structures, several different fracture modes with different crack nucleation and propagations were found and these were determined based on the orientation relationship between the BCC(B2) phase and the stress. In the first fracture mode of BCC(B2) phase (Fig. 10a), the crack was nucleated at the one end of BCC(B2) phase and then propagated through the lamella to the other end by leaving fishbone-shaped crack markings with radial stripes (marked with red solid lines) in the BCC(B2) lamella. However, the FCC(L12) lamellae between the BCC(B2) cracks exhibited a perfect plastic deformation by necking into sharp lines (bright lines) without any dimples. The radial directions of stripes in the BCC(B2) phase were along the crack growth orientation, and the negative directions pointed to the crack sources (marked with red triangles). All crack sources lay on short phase boundaries on the minor axis rather than long phase boundaries on the major axis because stresses gathered on the minor axis easily.","['fig10', 'fig10']",[]
3.5,Results.Fracture mechanisms,"Fig. 10b shows another fracture mode of BCC(B2) phase where cracks were nucleated at the BCC(B2) and FCC(L12) phase boundaries and then propagated along an orientation of 45° related to the phase boundaries. It is clear that massive ∼45° shear traces lay on each BCC(B2) phase lamella (as pointed by blue arrows) and evident cracks lay at the phase boundaries. Moreover, the BCC(B2) phase lamellae were broken into several parts by the ∼45° cracks (pointed by white arrows). Some cast shrinkage cavities (marked with red arrows) were also observed beside the cracks. These results indicated that stress gathered on the phase boundaries due to dislocation pile-up and induced micro-cracks around the cast shrinkage cavities. The propagation of micro-cracks along the ∼45° shear stress in the brittle BCC(B2) phase caused the early shearing fracture, leaving massive shear traces. Finally, the micro-cracks propagated along the phase boundaries, and the FCC(L12) phase fractured the latter by almost a pure shear mode.",['fig10'],[]
3.5,Results.Fracture mechanisms,"The aforementioned findings revealed that the crack first nucleated at the FCC(L12) and BCC(B2) phase boundaries due to stress concentration and then propagated in either normal or shear mode through the BCC(B2) phase, resulting in the fracture of BCC(B2) phase. The load was then imposed to the FCC(L12) phase, and due to the large strain hardening capability, the FCC(L12) phase was subjected to a perfect plastic deformation by necking into sharp lines (bright lines) without any dimples.",[],[]
4,Discussion,"Compared with the traditional metal materials, HEAs possess a specific atomic structure, which is the result of the mixing of elements with different atomic sizes, hence producing deformed lattices. The massive different atoms improve the solid solution strengthening and change the SFE. On the contrary, the frictional stress is assumed to be high due to the large lattice distortion caused by different atomic radii and moduli[19]. Therefore, the significant lattice distortion results in the high ductility and strain hardening of FCC HEAs in the absence of intermetallic phases. The lattice distortion might produce specific deformations of HEAs, which further determine their specific mechanical properties. Careful inspection of the literature, however, indicates that analyses of the deformation mechanisms of such complex alloys and especially the nature of defects are limited[9,11,30,38–40].",[],[]
