Section Heading,Section Title,Paragraph,Figures,Tables
4,Discussion,"The early study on the deformation mechanisms of FCC FeCrNiCoMn using TEM indicated that at a large range of temperatures (77–873 K), plastic deformation occurred by a planar dislocation glide on the classical FCC slip system, {111}<110> and SFs formed through dissociation of the unit dislocationb= a/2<110> in {111} plane into 1/6<112> Shockley partials[30]. When the plastic strain was larger than 20%, dislocations re-organized into cell structure, with the size range of 200–300 nm similar to other FCC alloys with low-to-medium SFE, at room temperature, and deformation twinning appeared at 77 K. The authors also suggested that the planar glide might be caused by the low SFE of the alloy or a short-range order effect. The planar dislocation glide was frequently reported in low SFE binary alloys, such as Cu-Al[36]and Cu-Zn[37]. A more recent study of the same FCC FeCrNiCoMn by means ofin situTEM observation revealed some unique deformation mechanisms. The planar slip was not continuous with extremely low velocity, which formed close-packed dislocation arrays and pile-ups in the activated {111} due to the strong drag effect of solute atoms[9]. In the present FCC(L12) phase of AlCoCrFeNi2.1EHEA, the observed planar dislocation slip and SFs were consistent with the initial deformation mechanisms of CoCrFeMnNi HEA reported in the literature. However, the planar slip continued to be the only deformation mechanism until the sample broke in the FCC(L12) phase without mechanical nano-twins, or dislocation cells created by the interaction of dislocations and cross-slip on different slip planes. A possible reason for the planar slip was the splitting of 1/2<110> dislocation into 1/6<112> Shockley partials with SFs in between, which would tend to minimize the cross-slip and confine the slip to the primary {111} plane[30]. Massive SFs indicated the extremely low SFE of FCC(L12) phase. Another possible reason might be the low plastic fracture strain (about 18%).",[],[]
4,Discussion,"For the BCC HEA, an early study of TiZrHfNbTa HEA indicated that at the meso-scopic level, deformation was not homogeneous but often located in intragranular shear bands[38]. Deformation twins were also observed near grain boundaries. A thermally activated dislocation glide was suggested as the deformation mechanism by the authors based on their analyses of the strain rate and temperature dependences of flow stress[38]. Moreover, the authors also proposed a mechanism based on solid solution strain hardening to explain the deformation behavior of this alloy[11]. More recent investigations of the same BCC TiZrHfNbTa HEA by means of TEM revealed that the dislocation glide was controlled by the movement of screw dislocation at the beginning of deformation, and the deformation was rapidly localized in two distinct bands where dislocation dipoles, loops, and tangles were induced at a higher plastic strain[39,40]. All the observed dislocations identified by the classical extinction rules unambiguously possessed a classical Burgers vector of BCC structure withb= a/2<111>. The dislocation patterns observed in the present BCC(B2) phase agreed with the literature results.",[],[]
4,Discussion,"Bulk coarse-grained B2 NiAl single-phase alloys are brittle at room temperature. This is because coarse-grained NiAl alloys possess only three independent slip systems that cannot produce cooperative deformation among grains[41]. One could speculate that the B2 rich-NiAl phase in the AlCoCrFeNi2.1EHEA with solid solution strengthening and Cr-enriched precipitate strengthening might be even more difficult to be plastically deformed. However, the results of the present study indicated no cracks at the phase boundary of the tensile deformed specimens (Figs. 3, 4 and 9), which suggested that both the FCC(L12) and BCC(B2) phases were deformed synchronously to about 18% elongation. The observed medium density of dislocations also provided enough evidence for the plastic deformation of BCC(B2) phase. The possible reasons for the enhanced plasticity of brittle BCC(B2) phase in the EHEA alloys might be the complex 3D back-stress states subjected to the FCC(L12) phase. In the literature, the back stress has been verified to improve the plasticity of nanostructured surface layer when adjacent to a coarse-grained core[42]. The back stress was produced in the heterogeneous systems during deformation and maintained the deformation synchronously. In the AlCoCrFeNi2.1EHEA, the boundaries of hard B2 phase and soft FCC(L12) phase were semi-coherent (seeFig. 9c), and these were enveloped by the soft FCC(L12) phase. These conditions favored the occurrence of back-stress effect that could result in massive dislocation in the FCC(L12) phase accumulated at the phase boundaries and activate more dislocations in the BCC(B2) phase compared with the independent coarse-grained NiAl alloys in the uniaxial stressed state during a tensile test.","['fig9', 'fig3', 'fig4', 'fig9']",[]
5,Conclusions,"In this study, the AlCoCrFeNi2.1EHEA was prepared using the casting technique. Tensile testing indicated that the EHEA possessed an excellent combination of high strength and high ductility. The un-deformed and post-deformed AlCoCrFeNi2.1EHEAs were further analyzed by means of XRD, EBSD, SEM, TEM, and APT as well as HRTEM. The main conclusions were as follows:",[],[]
5,Conclusions,"1. Microstructural analyses revealed that the AlCoCrFeNi2.1EHEA possessed a 3-D regular FCC(L12)/BCC(B2) composite structure, that is, a 2-D fine lamellar FCC(L12)/BCC(B2) modulated microstructures with a semi-coherent interface. A high density of Cr-enriched coherent nano-precipitates existed in the B2 phase.",[],[]
5,Conclusions,"2. Post-deformation analyses revealed a planar slip with characteristics of high density of parallel dislocation arrays and dense long straight {111} slip traces as well as massive SFs in the FCC(L12) phase, contributing to the high strain hardening and ductility of AlCoCrFeNi2.1EHEA. Moreover, a high density of dislocations pinned by the Cr-enriched nano-precipitates lying on the two {110} slip bands was found in the BCC(B2) phase, contributing to the high strength. In addition, solid solution hardening and semi-coherent phase boundaries also contributed to the high strength by pinning massive dislocations.",[],[]
5,Conclusions,"3. Fracture surface observations found a ductile fracture in the FCC(L12) phase and a brittle-like fracture in the BCC(B2) lamella. Several fracture modes, including fishbone-shaped crack markings with radial stripes and ∼45° shear fracture, were found in the BCC(B2) lamella, and a perfect plastic deformation by necking into one sharp line was found in the FCC(L12) lamella. During tension, cracks first nucleated on the phase boundaries by stress concentration and cast shrinkage cavities and then propagated in the BCC(B2) phase resulting in the fracture of BCC(B2) phase, and the FCC(L12) phase fractured finally with the load further increased.",[],[]
5,Conclusions,4. The high strength and high ductility of AlCoCrFeNi2.1EHEA originated from the back stress due to the coupling between the ductile FCC(L12) and brittle BCC(B2) phases during tensile deformation.,[],[]
