Section Heading,Section Title,Paragraph,Figures,Tables
4.3,Discussion.Comparison of mechanical properties with other alloys,"Fig. 7shows dependence of specific yield strength (SYS) of the studied AlCrxNbTiV alloys on the temperature. For the comparison, temperature dependencies of SYS of the NbTiZrV and CrNbTiVZr HEAs[14], Inconel 718 nickel-based superalloy[41], and γ-titanium aluminide-based alloy TNM[42]are also given. It should be noted that the data for the Inconel 718 and TNM alloys was obtained in tension testing. Apparently the SYS of the AlCrxNbTiV alloys increases with Cr content at temperatures of ≤800 °C, and gradually decreases with increase of temperature from ambient to 800 °C. At 1000 °C pronounced drop of SYS is observed. The studied AlCrxNbTiV alloys are stronger than the Inconel 718 at temperatures ≤800 °C, and the SYS of the AlCr1.5NbTiV alloy is almost two times higher than strength of the Inconel 718 alloy at 22 °C and 800 °C. However, the AlNbTiV and AlCr0.5NbTiV alloys are outperformed by the TNM alloy both at room temperature and at 800 °C. But the Laves phase-strengthened AlCrNbTiV and AlCr1.5NbTiV alloys demonstrate SYS superior to TNM alloy at temperatures below 1000 °C.",['fig7'],[]
4.3,Discussion.Comparison of mechanical properties with other alloys,"It is worth to compare the mechanical properties of the AlCrxNbTiV alloys with the properties of alloys of the Cr–Nb–Ti–V–Zr system, namely the NbTiVZr and CrNbTiVZr alloys[14]. The NbTiVZr alloy demonstrates lower SYS than the AlCrxNbTiV alloys at temperatures ≤800 °C. The NbTiVZr alloy has nearly single bcc phase structure with insignificant fraction of second phase particles[13]. Comparison between the strength of the nearly single phase NbTiVZr, AlNbTiV and AlCr0.5NbTiV alloys demonstrates that the Al and Cr have more pronounced solid solution strengthening effect when they are added to the bcc solid solutions based on NbTiV, than Zr. However, the NbTiVZr alloy can be compressed to 50% strain without fracture at room temperature, while the AlNbTiV and AlCr0.5NbTiV alloys have poor ductility at room temperatures and can be compressed to 50% strain without fracture only at 800 °C. Presumably, Al[43]and Cr in solid solution make the AlNbTiV and AlCr0.5NbTiV alloys brittle at low temperatures. Coarse-grained structure of the AlNbTiV and AlCr0.5NbTiV alloys could also limit their ductility, but good ductility of the NbTiVZr alloy with even higher grain size (300 μm and 600 μm[13]respectively) does not support this suggestion.",[],[]
4.3,Discussion.Comparison of mechanical properties with other alloys,"The CrNbTiVZr alloy has higher SYS than AlNbTiV and AlCr0.5NbTiV alloys at temperatures of 600 °C and 800 °C. Higher strength of the CrNbTiVZr alloy can be anticipated as it contains ≈61% of intermetallic Laves phase. However, the Laves-containing AlCrxNbTiV alloys, namely AlCrNbTiV and AlCr1.5NbTiV, generally have higher SYS then the CrNbTiVZr alloy despite the fact that they contain only 13% and 35% of Laves phase, respectively. Higher strength of the Laves-containing alloys of the Al–Cr–Nb–Ti–V system in comparison with the alloys of the Cr–Nb–Ti–V–Zr system despite lower volume fraction of Laves phase can be attributed to (i) higher strength of the bcc phase due to alloying with Al (previous paragraph) and (ii) possibly higher strength of the Laves phase. The Laves phase of the alloys have different crystal structures: hexagonal C14 in the AlCrNbTiV and AlCr1.5NbTiV alloys and cubic C15 in the CrNbTiVZr alloy. Potentially, higher symmetry of the cubic lattice can make the plastic deformation easier[44]. Microstructural observation support this suggestion: the Laves phase particles in the AlCrNbTiV and AlCr1.5NbTiV alloys do not show any evidences of plastic deformation and instead often appear fractured, while in the CrNbTiZr and CrNbTiVZr alloys recrystallization and deformation twinning of Laves phase is observed[14].",[],[]
4.3,Discussion.Comparison of mechanical properties with other alloys,"Although the AlCrNbTiV and AlCr1.5NbTiV demonstrate attractive SYS at temperatures up to 800 °C, they have extremely low ductility at room temperature. Apparently low ductility can be caused by heavily alloying of the bcc matrix with Al and Cr, and presence of brittle Laves phase particles. The simulated phase diagrams (Fig. 6) suggest that the Laves phase in the AlCrNbTiV and AlCr1.5NbTiV can be dissolved and precipitated in controlled manner, thus enabling optimization of their morphology and volume fraction. However, the results of both local chemical analysis and thermodynamic modeling demonstrate that while Cr tend to segregate in Laves phase, Al is found predominantly in bcc matrix phase (Tables 3–6). Although the Al provides significant strengthening, it also makes bcc phase brittle[20,43]. Heat treatment cannot solve this problem, therefore the chemical composition of the Al–Cr–Nb–Ti–V alloys has to be optimized, i.e. Al concentration has to be reduced, to provide optimum combination of strength and ductility.",['fig6'],"['tbl3', 'tbl4', 'tbl5', 'tbl6']"
5,Conclusions,"In this study, crystal structure, microstructure, density and compression mechanical properties at 22–1000 °C of the AlCrxNbTiV (x = 0, 0.5, 1, 1.5) alloys after homogenization annealing at 1200 °C for 24 h were examined. Following conclusions were made:1)After homogenization at 1200 °C the AlNbTiV and AlCr0.5NbTiV alloys are single-phase bcc solid solutions, while in the AlCrNbTiV and AlCr1.5NbTiV alloys respectively 13% and 35% of hexagonal C14 Laves phase are found in the bcc matrix. The Laves phase is enriched with Cr and Nb.2)The density of the AlCrxNbTiV alloys increases with increase of Cr concentration. The experimentally measured density of the AlNbTiV, AlCr0.5NbTiV, AlCrNbTiV and AlCr1.5NbTiV alloys is 5590 kg m−3, 5710 kg m−3, 5820 kg m−3and 5900 kg m−3, respectively.3)The AlCrxNbTiV (x = 0, 0.5, 1, 1.5) alloys demonstrate high compression strength at temperatures up to 800 °C. The strength increases with Cr content. For example, the compression yield strength of the AlNbTiV and AlCr1.5NbTiV alloys at room temperature is respectively 1000 MPa and 1700 °C, while at 800 °C the respective values are 560 MPa and 970 MPa. The specific yield strength of the AlCr1.5NbTiV at temperatures up to 800 °C was found to be superior to Cr–Nb–Ti–V–Zr system high entropy alloys, commercial nickel-based superalloy Inconel 718 and gamma-titanium aliminide based TNM alloy.4)The compression ductility of the AlCrxNbTiV (x = 0, 0.5, 1, 1.5) alloys decreases with increase of Cr content at room temperature and 600 °C. For example, at room temperature fracture strain of the AlNbTiV and AlCr1.5NbTiV alloys is 5.2% and 0%, respectively. At 600 °C, the respective values are 12.5% and 0.8%. At 800 °C and 1000 °C the AlCrxNbTiV (x = 0, 0.5, 1, 1.5) alloys can be compressed to 50% strain without fracture.5)After compression deformation at 800 °C and 1000 °C precipitation of second phases is observed in the AlCrxNbTiV (x = 0, 0.5, 1, 1.5) alloy. In the AlNbTiV and AlCr0.5NbTiV alloys Nb2Al-type phase, enriched with Nb and Al, precipitate mostly on grain boundaries of bcc phase. In the AlCrNbTiV and AlCr1.5NbTiV alloys hexagonal C14 Laves phase precipitates. The volume fraction and sizes of precipitated particles are higher after deformation at 1000 °C, probably due to hindered diffusion at 800 °C.6)Thermodynamic modeling of equilibrium phases in the AlCrxNbTiV (x = 0, 0.5, 1, 1.5) alloys demonstrated presence of single-phase bcc structure after solidification. At lower temperatures, formation of intermetallic phases is predicted: aluminide phase is expected in the AlNbTiV alloy, Laves phase in the AlCrNbTiV and AlCr1.5NbTiV alloys, and both aluminide and Laves phases in the AlCrNbTiV alloy. Comparison with experimental data demonstrates that thermodynamic modeling predicts correct trends, but does not provide accurate crystal structures, chemical compositions and volume fractions of phases in the AlCrxNbTiV (x = 0, 0.5, 1, 1.5) alloys.",[],[]
5,Conclusions,"After homogenization at 1200 °C the AlNbTiV and AlCr0.5NbTiV alloys are single-phase bcc solid solutions, while in the AlCrNbTiV and AlCr1.5NbTiV alloys respectively 13% and 35% of hexagonal C14 Laves phase are found in the bcc matrix. The Laves phase is enriched with Cr and Nb.",[],[]
5,Conclusions,"The density of the AlCrxNbTiV alloys increases with increase of Cr concentration. The experimentally measured density of the AlNbTiV, AlCr0.5NbTiV, AlCrNbTiV and AlCr1.5NbTiV alloys is 5590 kg m−3, 5710 kg m−3, 5820 kg m−3and 5900 kg m−3, respectively.",[],[]
5,Conclusions,"The AlCrxNbTiV (x = 0, 0.5, 1, 1.5) alloys demonstrate high compression strength at temperatures up to 800 °C. The strength increases with Cr content. For example, the compression yield strength of the AlNbTiV and AlCr1.5NbTiV alloys at room temperature is respectively 1000 MPa and 1700 °C, while at 800 °C the respective values are 560 MPa and 970 MPa. The specific yield strength of the AlCr1.5NbTiV at temperatures up to 800 °C was found to be superior to Cr–Nb–Ti–V–Zr system high entropy alloys, commercial nickel-based superalloy Inconel 718 and gamma-titanium aliminide based TNM alloy.",[],[]
5,Conclusions,"The compression ductility of the AlCrxNbTiV (x = 0, 0.5, 1, 1.5) alloys decreases with increase of Cr content at room temperature and 600 °C. For example, at room temperature fracture strain of the AlNbTiV and AlCr1.5NbTiV alloys is 5.2% and 0%, respectively. At 600 °C, the respective values are 12.5% and 0.8%. At 800 °C and 1000 °C the AlCrxNbTiV (x = 0, 0.5, 1, 1.5) alloys can be compressed to 50% strain without fracture.",[],[]
5,Conclusions,"After compression deformation at 800 °C and 1000 °C precipitation of second phases is observed in the AlCrxNbTiV (x = 0, 0.5, 1, 1.5) alloy. In the AlNbTiV and AlCr0.5NbTiV alloys Nb2Al-type phase, enriched with Nb and Al, precipitate mostly on grain boundaries of bcc phase. In the AlCrNbTiV and AlCr1.5NbTiV alloys hexagonal C14 Laves phase precipitates. The volume fraction and sizes of precipitated particles are higher after deformation at 1000 °C, probably due to hindered diffusion at 800 °C.",[],[]
5,Conclusions,"Thermodynamic modeling of equilibrium phases in the AlCrxNbTiV (x = 0, 0.5, 1, 1.5) alloys demonstrated presence of single-phase bcc structure after solidification. At lower temperatures, formation of intermetallic phases is predicted: aluminide phase is expected in the AlNbTiV alloy, Laves phase in the AlCrNbTiV and AlCr1.5NbTiV alloys, and both aluminide and Laves phases in the AlCrNbTiV alloy. Comparison with experimental data demonstrates that thermodynamic modeling predicts correct trends, but does not provide accurate crystal structures, chemical compositions and volume fractions of phases in the AlCrxNbTiV (x = 0, 0.5, 1, 1.5) alloys.",[],[]
