Section Heading,Section Title,Paragraph,Figures,Tables
0,Abstract,"The AlCrxNbTiV (x = 0, 0.5, 1, 1.5) high entropy alloys were produced by vacuum arc melting. The crystal structure, microstructure, density and compression mechanical properties at 22°C–1000 °C of the AlCrxNbTiV alloys after homogenization annealing at 1200 °C for 24 h are reported. After homogenization the AlNbTiV and AlCr0.5NbTiV alloys consist from single bcc solid solution phase, while the AlCrNbTiV and AlCr1.5NbTiV alloys contain bcc phase and respectively 13% and 35% of hexagonal (C14) Laves phase. The density of alloys increases with increase of Cr content from 5590 kg m−3 of the AlNbTiV alloy to 5900 kg m−3 of the AlCr1.5NbTiV alloy. The strength of the AlCrxNbTiV alloys increases with increase of Cr concentration at temperatures from room to 800 °C. The yield strength of the AlNbTiV and AlCr1.5NbTiV alloys is 1000 MPa and 1700 MPa respectively at room temperature and 560 MPa and 970 MPa at 800 °C. Strengthening of the AlCrxNbTiV alloys with increase of Cr content is accompanied by decrease of ductility. Phase composition of the alloys was affected by deformation at 800 °C and 1000 °C. In the AlNbTiV and AlCr0.5NbTiV alloys Nb2Al-type phase precipitated predominantly on grain boundaries, while in the AlCrNbTiV and AlCr1.5NbTiV alloys additional amounts of Laves phase appeared inside grains of bcc matrix. The experimentally observed phase composition of the AlCrxNbTiV alloys is compared with results of thermodynamical modeling of equilibrium phases in the alloys. The effect of phase composition of the alloys on mechanical properties is discussed and possibilities for properties optimization of the Al–Cr–Nb–Ti–V high entropy alloys are suggested.",[],[]
1,Introduction,"The so-called high-entropy alloys (HEAs) – alloys, usually composed of at least 5 elements in approximately equimolar proportions[1]– have recently attracted considerable attention, mostly due to their exceptional mechanical properties[2]. One of the potential applications of HEAs is high temperatures materials[3]. For that purpose, HEAs based on refractory elements were introduced[4]. Some of high entropy alloys based on refractory elements have demonstrated remarkable high temperature strength, outperforming currently used nickel-based superalloys[4–12]. However, the first-developed alloys had disadvantage of high density of more than 10000 kg m−3. Lighter alloys of the Cr–Nb–Ti–V–Zr system with density of ≈6500 kg m−3and attractive mechanical properties were introduced[13,14]. Addition of Al also has been proved to have beneficial effect on density and strength of HEAs intended for high temperature application[15–21]. For example, the AlNbTiV alloy has low density of 5590 kg m−3, single bcc phase structure and yield strength of 1020 MPa and 685 MPa at room temperature and 800 °C, respectively[20]. However, further increase of strength of the alloy is desirable in order to be more competitive with currently-used nickel-based superalloys.",[],[]
1,Introduction,"Intentional addition of second phase particles was recently suggested to be an effective strategy for development of HEAs for structural applications with desired properties[3]. Published data on structure of the Cr–Nb–Ti–V–Zr system alloys[13]suggests that addition of Cr to the AlNbTiV alloy can result in formation of Laves phase particles. Laves phase has been demonstrated to have beneficial effect on elevated temperature mechanical properties of the Cr–Nb–Ti–V–Zr system alloys[14]. Moreover, Cr content in hypothetical AlCrxNbTiV alloys supposedly can control volume fraction of Laves phase. It can be suggested that mechanical properties of the AlCrxNbTiV alloys would be largely determined by volume fraction of Laves phase. For example, direct correlation between volume fractions of respective B2 phase and σ-phase and strength was found in AlxCoCrFeNiMn and CoCrFeNiMnVxalloys[22,23]. However, experimental studies are required to prove these suggestions.",[],[]
1,Introduction,"In most cases, the volume fraction of second phase(s) will be dependent not only on chemical composition of the alloy, but also on temperature. The temperature dependence of phase composition may result in structure instability at elevated temperature and provide the possibility to control second phase precipitates via annealing treatment[24]. In conventional alloys phase diagrams are used to predict stable phases at given temperatures. However, the experimental data on phase diagrams of compositionally complex HEAs is extremely limited[25,26]. Application of thermodynamic modeling can provide useful results[13,27–29], but does not always results in accurate predictions of phase transformations in HEAs[30]. Comparison between the experimentally observed phases in the promising alloys with predicted ones is required to establish the validity of thermodynamic modeling results.",[],[]
1,Introduction,"Therefore, the aim of current work can be summarize as following: (i) to examine structure of the AlCrxNbTiV (x = 0, 0.5, 1, 1.5) alloys and establish dependence of phase composition on Cr content; (ii) to study high temperature mechanical behavior of the AlCrxNbTiV alloys and to analyze effect of phase composition on strength of the alloys; (iii) to compare phase structure of the AlCrxNbTiV alloys with thermodynamic modeling predictions; (iv) to compare specific properties of the AlCrxNbTiV alloys with other high-temperature materials.",[],[]
2,Experimental procedures,"The alloys with nominal composition of Al25Nb25Ti25V25(subscripts indicate at.-% of corresponding elements, all the compositions given in text will be in at.-%), Al22Cr12Nb22Ti22V22, Al20Cr20Nb20Ti20V20and Al18Cr28Nb18Ti18V18, further denoted as AlNbTiV, AlCr0.5NbTiV, AlCrNbTiV and AlCr1.5NbTiV, were produced by arc melting of the elements in a low-pressure, high-purity argon atmosphere inside a water-cooled copper cavity. The purities of the alloying elements were above 99.9%. To ensure chemical homogeneity, the ingots were flipped over and re-melted at least 5 times. The produced ingots of the alloys had dimensions of about 6 × 12 × 40 mm3. The cast ingots of the alloys were homogenized at 1200 °C for 24 h, in accord with regime used previously for the AlNbTiV and CrNbTiVZr alloys[13,20]. Prior to homogenization, the samples were sealed in vacuumed (10−2torr) quartz tubes filled with titanium chips to prevent oxidation. After annealing, the tubes with the samples were removed from the furnace and were cooled down to room temperature due to heat exchange with surrounding air. No signs of oxidation were observed after annealing.",[],[]
2,Experimental procedures,"Density of the homogenized alloys was measured hydrostatic weighting method. Density was measured on compressive specimens (see below), 3 samples of each alloy were measured. Compressive tests were performed on rectangular specimens with dimensions of 6 × 4 × 4 mm3using the Instron 300LX machine equipped with radial heating furnace. The compressive specimens were cut from homogenized ingots and carefully polished prior to testing. The specimens for testing were mechanically polished up to 4000 grit and then polished with OP-S suspension. Testing was carried out at temperatures of 22 °C, 600 °C, 800 °C and 1000 °C. For high temperature testing, specimens were put in preheated furnace, which was kept at desired temperature for ≈1 h, and held for 10 min prior to testing to equilibrate the temperature. The temperature of the specimen was controlled by thermocouple attached to its side surface. The initial strain rate was 10−4s−1. Testing was carried out to fracture of the specimens or to 50% strain. After testing specimens were taken out from the furnace and cooled on air. Signs of oxidation were found only after testing at 1000 °C. Samples after 50% compression strain were cut in half and their structure was studied on plane parallel to compression axis.",[],[]
2,Experimental procedures,"Crystal structure and microstructure of the homogenized and deformed alloys were studied using X-ray diffraction (XRD) and scanning electron microscopy (SEM) techniques on the carefully mechanically polished samples. The specimens for structural investigations were mechanically polished up to 4000 grit and then polished with OP-S suspension. The XRD analysis was performed using RIGAKU diffractometer and Cu Kα radiation. SEM investigations were performed utilizing Quanta 600 FEG and Quanta 200 3D microscopes equipped with back-scattered electron (BSE), energy-dispersive (EDS) and electron backscattered diffraction (EBSD) detectors. The average grain size and dimensions of second phase particles were measured from SEM-BSE images using the linear intercept method with Digimizer Image Analysis Software. Volume fraction of different phases was also measured using the same software and binarization procedure. Chemical composition of the alloys was measured using SEM-EDS by scanning area of 2 × 2 mm2. 2–3 scans in different areas were performed. Chemical composition of different structural constituents of the alloys was measured by point SEM-EDS analysis. 5–10 points were analyzed for each constituent. EBSD maps of bcc phase were collected with step size of 0.2–0.5 μm. TSL OIM Analysis 5.2 software was used to produce EBSD inverse pole figure (IPF) maps. Points with confidence index (CI) below 0.05 were excluded from consideration. No clean-up procedure was used. The low-angle (<15°) and high-angle (≥15 °C) boundaries are shown as white and black lines respectively.",[],[]
2,Experimental procedures,Thermodynamic modeling of equilibrium phase diagrams was conducted using Thermo-Calc (version 5) software employing TTTI3 (titanium alloys) database.,[],[]
3.1,"Results.Density and mechanical properties of the AlCrxNbTiV (x = 0, 0.5, 1, 1.5) alloys","The experimentally determined density of the of the AlCrxNbTiV alloys after homogenization annealing is given inTable 1. The given values demonstrates that increase of Cr content results in gradual increase of density of the alloys from 5590 kg m−3of the AlNbTiV to 5900 kg m−3of the AlCr1.5NbTiV alloy. Using the rule of mixtures and densities of the constitutive elements, the densities of disordered solid solutions with composition of the studied alloys were calculated (Table 3) using the following formula:(1)ρmix=∑Aici/∑((Aici)/ρi);where Ai, ciand ρiare atomic weight, concentration and density of theielement. Good correlation between the experimentally determined and calculated values of the density is observed. Good correlation between rule of mixture predictions and experimental density has been already reported for HEAs having either single solid solution phase or multiple phases, including ordered or intermetallic ones[4,7,8,13,15,17,20,21].",[],"['tbl1', 'tbl3']"
3.1,"Results.Density and mechanical properties of the AlCrxNbTiV (x = 0, 0.5, 1, 1.5) alloys","Fig. 1demonstrates the compressive stress–strain curves, obtained during testing of the AlCrxNbTiV (x = 0, 0.5, 1, 1.5) alloys at different temperatures.Table 2summarizes compression mechanical properties of the alloys, namely yield strength, σYS, peak stress, σP, and compression fracture strain, ε. Apparently, Cr content has pronounced effect on mechanical properties of the alloys. For example, at room temperature all alloys demonstrate high yield strength, but limited ductility. Increase of Cr content in the AlCrxNbTiV alloys gradually makes them stronger but less ductile: the AlNbTiV alloy has yield strength of 1000 MPa, peak stress of 1280 MPa and fracture strain of 5.2%, whereas corresponding values for the AlCr1.5NbTiV alloy are 1700 MPa, 1700 MPa and 0%.",['fig1'],['tbl2']
3.1,"Results.Density and mechanical properties of the AlCrxNbTiV (x = 0, 0.5, 1, 1.5) alloys","Increase of the testing temperature to 600 °C results in decrease of strength and increase of ductility of the alloys. The yield strength of the AlNbTiV alloy decreases to 780 MPa, but the fracture strain increases to 12.5%, while the AlCr1.5NbTiV alloy has yield strength of 1370 MPa and fracture strain of 0.8%. At higher temperature of 800 °C, pronounced increase of ductility of the AlCrxNbTiV alloys was observed – they were compressed to 50% strain without fracture. The yield strength of the AlNbTiV and AlCr1.5NbTiV alloys decreases to 560 MPa and 970 MPa respectively. The respective peak stress values are 700 MPa and 1045 MPa. Unlike deformation at lower temperatures, at 800 °C the stress–strain curves demonstrate pronounced softening stage after reaching peak stress. After softening stage, the AlNbTiV, AlCr0.5NbTiV and AlCrNbTiV demonstrate some hardening, while flow stress of the AlCr1.5NbTiV alloy continues to decrease gradually. At 1000 °C the yield strength of the alloys decreases pronouncedly, to 110 MPa for the AlNbTiV alloy and to 75 MPa for the AlCr1.5NbTiV alloy. After yielding, prolonged steady state flow stage is observed in the stress–strain curves of the AlNbTiV alloy, while during compression of the AlCr0.5NbTiV, AlCrNbTiV and AlCr1.5NbTiV alloys softening stage is observed after stress reaches peak value. Softening is more pronounced in the AlCrNbTiV alloy. The reasons why the stress–strain curves of the AlCrxNbTiV alloys demonstrate pronounced softening stage during compression at 800 °C and 1000 °C are unclear at the moment and require further studies which are beyond the scope of current work. Also, the increase of stress after reaching 30–40% strain during testing at 800 °C and 1000 °C is likely associated with barreling of the specimens.",[],[]
3.2.1,"Results.Structure of the AlCrxNbTiV (x = 0, 0.5, 1, 1.5) alloys.XRD analysis of the AlCrxNbTiV (x = 0, 0.5, 1, 1.5) alloys","The XRD patterns of the AlCrxNbTiV (x = 0, 0.5, 1, 1.5) alloys are shown inFig. 2. The AlNbTiV alloy has single bcc phase structure in the as-homogenized state (Fig 2a), which agrees with the previously published data[20]. Only two strong diffraction peaks are observed, possibly due to strong crystallographic texture. The same bcc structure retains after compression testing at 800 °C and 1000 °C. After deformation more Bragg peaks from bcc lattice are visible, probably due to weakening of initial texture. The lattice parameter of the bcc phase is not significantly affected by deformation and equals to 0.3186 ± 0.0005 nm. In addition to the bcc lattice, tiny peaks from tetragonal Nb2Al-type phase are found after deformation. The lattice parameters of the Nb2Al phase are a = 1.005 ± 0.003 nm and c = 0.512 ± 0.006 nm. The diffraction patterns of the AlCr0.5NbTiV alloy (Fig. 2b) are very similar to those of the AlNbTiV alloy: single, strongly textured, bcc phase is observed in the homogenized condition. Number of distinguished diffraction peaks from the bcc phase increases after deformation. Probably, deformation twinning and/or dynamic recrystallization result in weakening of initial texture in the AlNbTiV and AlCr0.5NbTiV alloys after deformation. The lattice parameter of the bcc phase of the AlCr0.5NbTiV alloy is 0.316 ± 0.005 nm. Nb2Al-type phase is also observed in the AlCr0.5NbTiV alloy after deformation. It has lattice parameters of a = 0.993 ± 0.001 nm and c = 0.4326 ± 0.0004 nm.","['fig2', 'fig2', 'fig2']",[]
3.2.1,"Results.Structure of the AlCrxNbTiV (x = 0, 0.5, 1, 1.5) alloys.XRD analysis of the AlCrxNbTiV (x = 0, 0.5, 1, 1.5) alloys","The XRD patterns of the AlCrNbTiV alloy are shown inFig. 2c. XRD analysis indicates presence of two phases in the alloy in homogenized condition – bcc phase and Laves phase with hexagonal (C14) lattice. The deformation does not result in any noticeable changes in phase composition of the alloy. The lattice parameters of bcc and Laves phases are 0.3154 ± 0.0022 nm and a = 0.4990 ± 0.0006 nm and c = 0.8220 ± 0.0011 nm. Some increase of value of the lattice parameter of the bcc phase to 0.3174 ± 0.0003 nm can be found after compression at T = 800 °C, meanwhile the lattice parameters of Laves phase are unchanged. The XRD patterns of the AlCr1.5NbTiV alloy (Fig. 2d) are similar to those observed for the AlCrNbTiV alloy, but the intensity of diffraction peaks from the Laves phase is significantly higher. The lattice parameter of the bcc phase is 0.3135 ± 0.0015 nm, and the lattice parameters of the Laves phase are а = 0.4990 ± 0.0005 nm and c = 0.8215 ± 0.0010 nm.","['fig2', 'fig2']",[]
3.2.2,"Results.Structure of the AlCrxNbTiV (x = 0, 0.5, 1, 1.5) alloys.SEM analysis of the AlCrxNbTiV (x = 0, 0.5, 1, 1.5) alloys after homogenization","The microstructures of the AlCrxNbTiV (x = 0; 0.5; 1; 1.5) alloys in the homogenized state are presented inFig. 3.Table 3summarizes data on chemical composition of structural constituents of the alloys as well as average actual chemical composition of the alloys.Fig. 3a and b demonstrate that the AlNbTiV and AlCr0.5NbTiV alloys have single phase coarse-grained structure with average grain size of ≈300 ± 25 μm and ≈300 ± 55 μm, respectively. No signs of second phases are found. The chemical composition of the grains is close to the actual composition of the alloys (Table 3). Formation of light second phase particles in the AlCrNbTiV alloy with higher Cr content is observed (Fig. 3c). The particles can be identified as Laves phase. The light particles are located both along the grain boundaries as discrete network and within grains as parallelepiped particles with average transversal and longitudinal sizes in examined projection of ≈3.0 ± 1.1 μm and ≈8.0 ± 2.6 μm, respectively. Their volume fraction is 13 ± 2%. The light particles are enriched with Nb (25.5%) and Cr (34.5%), and depleted of Al (18.0%), Ti (9.4%) and V (12.6%) (Table 3). Chemical composition of the matrix grains is close to the composition of the alloy, although slightly lower Cr content and slightly higher Ti content in the grains in comparison with alloys' composition can be noted. The average size of matrix grains is ≈ 150 ± 20 μm. Microstructure of the AlCr1.5NbTiV alloy (Fig. 3d) resembles microstructure of the AlCrNbTiV alloy. Volume fraction of the light second phase particles increases to 35 ± 3%. The increase of the volume fraction of the second phase particles is mainly associated with particles located within grains and not with grain boundary particles. The shape of the second phase particles within matrix grains becomes closer to equiaxed, and their size increases: average transversal and longitudinal sizes are 7.0 ± 2.9 μm and 13.0 ± 3.9 μm. The light particles are enriched with Nb (24.4%) and Cr (36.8%), and depleted of Al (16.9%), Ti (10.3%) and V (11.6%) (Table 3). The composition of the matrix grains is reasonably close to the actual composition of the alloy, although they are depleted of Cr (20.4%). Their average size is about 150 ± 10 μm. Twice lower bcc grain size in the AlCrNbTiV and AlCr1.5NbTiV alloys in comparison with the AlNbTiV and AlCr0.5NbTiV alloys can be the reason for weaker texture observed in the homogenized alloys (Fig. 2).","['fig3', 'fig3', 'fig3', 'fig3', 'fig2']","['tbl3', 'tbl3', 'tbl3', 'tbl3']"
3.2.3,"Results.Structure of the AlCrxNbTiV (x = 0, 0.5, 1, 1.5) alloys.SEM analysis of the AlCrxNbTiV (x = 0, 0.5, 1, 1.5) alloys after compression testing at 800 °C and 1000 °C","Microstructures of the AlCrxNbTiV alloys after compressive testing at 800 °C to 50% height reduction are shown inFig. 4. The AlNbTiV alloy (Fig. 4a) nearly retains single-phase microstructure of the homogenized alloy (Fig. 3a). Inside grains thin lamellar structure is found, probably due to twinning or deformation banding. Higher magnification insert inFig. 4a demonstrates presence of extremely fine precipitations (their size cannot be adequately estimated from SEM images) on grain boundaries of bcc matrix. The thickness of precipitation-containing zones can be estimated as of ∼1 μm. Due to fine scale and limited volume fraction of precipitates, the SEM-based EDX analysis has not revealed noticeable difference in composition between the grains and precipitation-containing zones on the grain boundaries (Table 4). However, the XRD data (Fig. 3a) suggests that the fine precipitates are Nb2Al-type phase particles. Additional transmission electron microscopy studies are required to precisely identify the fine precipitates in the AlNbTiV alloy (as well as precipitates in other alloys), but these studies are beyond the scope of current paper. The EBSD map of the AlNbTiV alloy (Fig. 4b) demonstrates that most of the lamellae inside bcc grains have high-angle boundaries. The misorientation of many boundaries is of ≈50°, which is close to misorientation of Ʃ11 twin boundaries (50.48°). Ʃ11 twins are found in plastically deformed bcc alloys[31], and twinning has already been reported to be an active deformation mechanism in a single bcc phase HfNbTaTiZr HEA[6].","['fig4', 'fig4', 'fig3', 'fig4', 'fig3', 'fig4']",['tbl4']
3.2.3,"Results.Structure of the AlCrxNbTiV (x = 0, 0.5, 1, 1.5) alloys.SEM analysis of the AlCrxNbTiV (x = 0, 0.5, 1, 1.5) alloys after compression testing at 800 °C and 1000 °C","The microstructure of the AlCr0.5NbTiV alloy (Fig. 4c) is very similar to AlNbTiV alloy: lamellar structure is observed inside the bcc matrix grains. At the grain boundaries fine light precipitates appear, forming precipitation-containing zones with thickness of several microns (higher magnification insert inFig. 4c). The EDX analysis does not demonstrate any difference in chemical composition between the grains and precipitation-containing zones (Table 4), but XRD (Fig. 3b) suggests that Nb2Al-type particles precipitate on grain boundaries of the AlCr0.5NbTiV alloy after deformation at 800 °C. The EBSD map (Fig. 4d) demonstrates high misoriention of lamellae boundaries, implying that the lamellar structure in the bcc grains is produced by mechanical twinning. The EBSD map also confirms that precipitation-containing zone (thick black line crossing the IPF map) is located on initial grain boundary, separating two grains with distinctively different crystal orientation.","['fig4', 'fig4', 'fig3', 'fig4']",['tbl4']
3.2.3,"Results.Structure of the AlCrxNbTiV (x = 0, 0.5, 1, 1.5) alloys.SEM analysis of the AlCrxNbTiV (x = 0, 0.5, 1, 1.5) alloys after compression testing at 800 °C and 1000 °C","The AlCrNbTiV alloy after deformation at 800 °C has distinctively different microstructure (Fig. 4e) from the previously discussed AlNbTiV and AlCr0.5NbTiV alloys. Similarly to homogenized condition, light Laves phase particles are located both on grain boundaries and inside grains of bcc matrix. The volume fraction of the coarse Laves phase particles is 14 ± 1%. Formation of dark deformation bands can be observed in grains of bcc matrix. The deformation bands are often initiated at the light Laves particles. It seems that some of the Laves phase particles undergo fracture due to deformation. Also, precipitation of fine light particles from bcc matrix is observed. The size of precipitates is estimated of 0.2–0.5 μm. The precipitates are non-uniformly distributed and tend to appear on deformation bands. The volume fraction of the fine precipitates is 6 ± 2%. The chemical composition of the coarse Laves phase particles (Table 4) is close to the composition of Laves phase particles observed in the homogenized alloy (Table 3). The chemical composition of the precipitate-containing zones is nearly identical to the composition of precipitation-free matrix (Table 4). However, as no other phases then bcc solid solution and C14 Laves phase were detected by XRD (Fig. 2c), it can be deduced that the fine precipitates are also hexagonal Laves phase particles. Microstructure of the AlCr1.5NbTiV alloy after compression at 800 °C (Fig. 4f) is similar to the AlCrNbTiV alloy (Fig. 4e). Precipitation of presumably (according to XRD results) Laves phase particles is observed. The volume fraction of the coarse light Laves phase particles and the fine Laves precipitates are respectively 34 ± 3% and 10 ± 2%. The results of EDX analysis demonstrate no difference in chemical composition of precipitation-containing zones and precipitation-free bcc matrix (Table 4).","['fig4', 'fig2', 'fig4', 'fig4']","['tbl4', 'tbl3', 'tbl4', 'tbl4']"
