Table ID,Table Path,Table Label,Table Caption,Table Footer
t0005,C:\Users\D. Sai Mani Kumar\Downloads\XML_Extractor\articles_test\10.1016.j.pnsc.2015.09.001\tables\Table 1.csv,Table 1,The crystalline phase and crystalline lattices of the Nb20Ni20Ti20Co20Zr20 and Nb16.7Ni16.7Ti16.7Co16.7Zr16.7Hf16.7 HEAs.,
t0010,C:\Users\D. Sai Mani Kumar\Downloads\XML_Extractor\articles_test\10.1016.j.pnsc.2015.09.001\tables\Table 2.csv,Table 2,Vickers microhardness values of the Nb20Ni20Ti20Co20Zr20 and Nb16.7Ni16.7Ti16.7Co16.7Zr16.7Hf16.7 HEAs.,
t0015,C:\Users\D. Sai Mani Kumar\Downloads\XML_Extractor\articles_test\10.1016.j.pnsc.2015.09.001\tables\Table 3.csv,Table 3,"The s
0.2 and s
u values of the Nb20Ni20Ti20Co20Zr20 HEA at different temperatures.",
