Table ID,Table Path,Table Label,Table Caption,Table Footer
tbl1,/home/sai/sai-mani/articles_all/10.1016.j.matchemphys.2005.01.001/tables/Table 1.csv,Table 1,"EDX analyses of the compositions of FeCoNiCr, FeCoNiCrCu0.5, and FeCoNiCrCu",
tbl2,/home/sai/sai-mani/articles_all/10.1016.j.matchemphys.2005.01.001/tables/Table 2.csv,Table 2,EDX analyses of the dendrite and interdendrite structure of as-cast FeCoNiCrCu0.5 and FeCoNiCrCu alloys,
tbl3,/home/sai/sai-mani/articles_all/10.1016.j.matchemphys.2005.01.001/tables/Table 3.csv,Table 3,"Chemical mixing enthalpy (DH
chem) of a pair of atoms [5,11-13]",
tbl4,/home/sai/sai-mani/articles_all/10.1016.j.matchemphys.2005.01.001/tables/Table 4.csv,Table 4,"Average corrosion rates (mmyear-1) of as-cast FeCoNiCrCu
x
 alloys in 3.5% NaCl solution at 25degC","{'a': 'Average corrosion rate is converted from weight loss data.', 'b': ""Average corrosion rate is obtained from Tafel region extrapolation and Faraday's law.""}"
tbl5,/home/sai/sai-mani/articles_all/10.1016.j.matchemphys.2005.01.001/tables/Table 5.csv,Table 5,"Electrochemical parameters of as-cast FeCoNiCrCu
x
 alloys and 304L stainless steel in 3.5% NaCl solution at 25degC","{'a': 'E\ncorr: corrosion potential.', 'b': 'E\npit: pitting potential.', 'c': 'i\ncorr: corrosion current density.'}"
